,name,id,address,date,kWh,public_url,installationDate,uid,datetime,Year,Month,Day,Hour,Minute,Temperature,Alpha,Aerosol Optical Depth,Asymmetry,Clearsky DHI,Clearsky DNI,Clearsky GHI,Cloud Fill Flag,Cloud Type,Dew Point,DHI,DNI,Fill Flag,GHI,Ozone,Relative Humidity,Solar Zenith Angle,SSA,Surface Albedo,Pressure,Precipitable Water,Wind Direction,Wind Speed,Global Horizontal UV Irradiance (280-400nm),Global Horizontal UV Irradiance (295-385nm),maximumPower
0,Telus Spark,594148,220 ST GEORGES DR NE,19/11/2017 8:00,0.302,https://monitoring.solaredge.com/solaredge-web/p/public?name=TELUS%20Spark,27/11/2017,5941482017-11-19 08:00:00,2017-11-19 08:00:00,2017,11,19,7,30,-4.5,1.24,0.018,0.62,0,0,0,4,6,-7.4,0,0,4,0,0.28,80.03,94.96,0.93,0.73,879,0.8,239,2.3000000000000003,0.0,0.0,273.0
1,Telus Spark,594148,220 ST GEORGES DR NE,19/11/2017 9:00,1.814,https://monitoring.solaredge.com/solaredge-web/p/public?name=TELUS%20Spark,27/11/2017,5941482017-11-19 09:00:00,2017-11-19 09:00:00,2017,11,19,8,30,-3.5,1.25,0.02,0.62,19,405,42,4,6,-7.5,26,2,4,26,0.28,74.05,86.7,0.93,0.73,878,0.8,236,2.5,0.0,0.0,273.0
2,Telus Spark,594148,220 ST GEORGES DR NE,19/11/2017 10:00,3.734,https://monitoring.solaredge.com/solaredge-web/p/public?name=TELUS%20Spark,27/11/2017,5941482017-11-19 10:00:00,2017-11-19 10:00:00,2017,11,19,9,30,-1.5,1.25,0.021,0.62,38,678,156,4,6,-6.2,97,24,4,101,0.279,70.14,79.96000000000001,0.93,0.73,877,0.8,230,2.7,4.8156,3.6699,273.0
3,Telus Spark,594148,220 ST GEORGES DR NE,19/11/2017 11:00,10.2,https://monitoring.solaredge.com/solaredge-web/p/public?name=TELUS%20Spark,27/11/2017,5941482017-11-19 11:00:00,2017-11-19 11:00:00,2017,11,19,10,30,0.1,1.27,0.021,0.62,49,793,257,4,8,-4.6000000000000005,144,45,4,156,0.277,70.76,74.74,0.93,0.73,876,0.8,223,2.7,7.6459,5.8786,273.0
4,Telus Spark,594148,220 ST GEORGES DR NE,19/11/2017 12:00,8.991,https://monitoring.solaredge.com/solaredge-web/p/public?name=TELUS%20Spark,27/11/2017,5941482017-11-19 12:00:00,2017-11-19 12:00:00,2017,11,19,11,30,1.1,1.27,0.021,0.62,54,842,321,4,8,-3.4000000000000004,154,15,4,159,0.276,71.94,71.54,0.93,0.73,875,0.8,220,2.6,8.0263,6.2027,273.0
5,Telus Spark,594148,220 ST GEORGES DR NE,19/11/2017 13:00,7.673,https://monitoring.solaredge.com/solaredge-web/p/public?name=TELUS%20Spark,27/11/2017,5941482017-11-19 13:00:00,2017-11-19 13:00:00,2017,11,19,12,30,1.8,1.26,0.022,0.62,56,852,338,4,8,-2.8000000000000003,150,12,4,154,0.274,71.74,70.67,0.93,0.73,875,0.8,226,2.8000000000000003,7.8363,6.0631,273.0
6,Telus Spark,594148,220 ST GEORGES DR NE,19/11/2017 14:00,4.168,https://monitoring.solaredge.com/solaredge-web/p/public?name=TELUS%20Spark,27/11/2017,5941482017-11-19 14:00:00,2017-11-19 14:00:00,2017,11,19,13,30,2.0,1.28,0.022,0.62,53,831,307,4,4,-2.9000000000000004,172,7,4,174,0.272,69.79,72.23,0.93,0.73,874,0.8,234,3.2,8.7274,6.7377,273.0
7,Telus Spark,594148,220 ST GEORGES DR NE,19/11/2017 15:00,2.535,https://monitoring.solaredge.com/solaredge-web/p/public?name=TELUS%20Spark,27/11/2017,5941482017-11-19 15:00:00,2017-11-19 15:00:00,2017,11,19,14,30,1.7000000000000002,1.34,0.019,0.62,45,774,232,4,8,-3.1,140,73,4,157,0.272,70.56,76.06,0.93,0.73,873,0.8,236,3.3000000000000003,7.6096,5.8367,273.0
8,Telus Spark,594148,220 ST GEORGES DR NE,19/11/2017 16:00,0.471,https://monitoring.solaredge.com/solaredge-web/p/public?name=TELUS%20Spark,27/11/2017,5941482017-11-19 16:00:00,2017-11-19 16:00:00,2017,11,19,15,30,0.8,1.38,0.021,0.62,34,626,123,4,8,-3.2,82,26,4,85,0.273,74.59,81.78,0.93,0.73,872,0.8,239,3.4000000000000004,0.0,0.0,273.0
9,Telus Spark,594148,220 ST GEORGES DR NE,20/11/2017 8:00,0.21,https://monitoring.solaredge.com/solaredge-web/p/public?name=TELUS%20Spark,27/11/2017,5941482017-11-20 08:00:00,2017-11-20 08:00:00,2017,11,20,7,30,-8.200000000000001,1.32,0.07,0.62,0,0,0,0,4,-9.4,0,0,0,0,0.246,91.2,95.17,0.96,0.78,880,0.6000000000000001,30,1.9,0.0,0.0,273.0
10,Telus Spark,594148,220 ST GEORGES DR NE,20/11/2017 9:00,2.013,https://monitoring.solaredge.com/solaredge-web/p/public?name=TELUS%20Spark,27/11/2017,5941482017-11-20 09:00:00,2017-11-20 09:00:00,2017,11,20,8,30,-8.3,1.32,0.073,0.62,23,266,38,7,4,-10.3,21,0,7,21,0.241,85.24,86.91,0.96,0.78,881,0.6000000000000001,36,1.7000000000000002,0.0,0.0,273.0
11,Telus Spark,594148,220 ST GEORGES DR NE,20/11/2017 10:00,1.206,https://monitoring.solaredge.com/solaredge-web/p/public?name=TELUS%20Spark,27/11/2017,5941482017-11-20 10:00:00,2017-11-20 10:00:00,2017,11,20,9,30,-7.4,1.33,0.072,0.62,51,575,149,7,4,-10.4,89,1,7,90,0.239,79.41,80.19,0.96,0.78,882,0.6000000000000001,39,1.9,0.0,0.0,273.0
12,Telus Spark,594148,220 ST GEORGES DR NE,20/11/2017 11:00,0.682,https://monitoring.solaredge.com/solaredge-web/p/public?name=TELUS%20Spark,27/11/2017,5941482017-11-20 11:00:00,2017-11-20 11:00:00,2017,11,20,10,30,-6.4,1.34,0.07,0.62,67,711,251,7,4,-9.6,85,0,7,85,0.238,78.0,74.97,0.96,0.78,883,0.6000000000000001,39,2.1,4.1576,3.1953,273.0
13,Telus Spark,594148,220 ST GEORGES DR NE,20/11/2017 12:00,1.616,https://monitoring.solaredge.com/solaredge-web/p/public?name=TELUS%20Spark,27/11/2017,5941482017-11-20 12:00:00,2017-11-20 12:00:00,2017,11,20,11,30,-5.800000000000001,1.34,0.073,0.62,76,764,315,7,4,-9.4,24,0,7,24,0.237,75.67,71.77,0.96,0.78,883,0.6000000000000001,37,2.3000000000000003,1.2089,0.934,273.0
14,Telus Spark,594148,220 ST GEORGES DR NE,20/11/2017 13:00,2.604,https://monitoring.solaredge.com/solaredge-web/p/public?name=TELUS%20Spark,27/11/2017,5941482017-11-20 13:00:00,2017-11-20 13:00:00,2017,11,20,12,30,-5.6000000000000005,1.33,0.073,0.62,78,778,333,7,4,-9.3,158,1,7,159,0.237,75.16,70.89,0.96,0.78,884,0.6000000000000001,35,2.6,8.0745,6.2456,273.0
15,Telus Spark,594148,220 ST GEORGES DR NE,20/11/2017 14:00,1.081,https://monitoring.solaredge.com/solaredge-web/p/public?name=TELUS%20Spark,27/11/2017,5941482017-11-20 14:00:00,2017-11-20 14:00:00,2017,11,20,13,30,-5.800000000000001,1.34,0.065,0.62,72,766,303,7,4,-9.5,114,0,7,114,0.236,75.18,72.44,0.96,0.78,885,0.6000000000000001,34,2.8000000000000003,5.7068,4.4044,273.0
16,Telus Spark,594148,220 ST GEORGES DR NE,20/11/2017 15:00,0.371,https://monitoring.solaredge.com/solaredge-web/p/public?name=TELUS%20Spark,27/11/2017,5941482017-11-20 15:00:00,2017-11-20 15:00:00,2017,11,20,14,30,-6.7,1.32,0.065,0.62,62,692,227,7,4,-10.1,102,1,7,103,0.236,76.8,76.25,0.96,0.78,886,0.6000000000000001,35,2.8000000000000003,4.9849,3.8222,273.0
17,Telus Spark,594148,220 ST GEORGES DR NE,20/11/2017 16:00,0.013,https://monitoring.solaredge.com/solaredge-web/p/public?name=TELUS%20Spark,27/11/2017,5941482017-11-20 16:00:00,2017-11-20 16:00:00,2017,11,20,15,30,-8.200000000000001,1.32,0.063,0.62,44,532,118,7,4,-11.2,44,0,7,44,0.235,78.97,81.95,0.96,0.78,887,0.6000000000000001,34,2.6,0.0,0.0,273.0
18,Telus Spark,594148,220 ST GEORGES DR NE,21/11/2017 8:00,0.257,https://monitoring.solaredge.com/solaredge-web/p/public?name=TELUS%20Spark,27/11/2017,5941482017-11-21 08:00:00,2017-11-21 08:00:00,2017,11,21,7,30,-12.5,1.36,0.029,0.62,0,0,0,4,8,-15.3,0,0,4,0,0.253,79.62,95.39,0.93,0.8,894,0.7000000000000001,148,2.4000000000000004,0.0,0.0,273.0
19,Telus Spark,594148,220 ST GEORGES DR NE,21/11/2017 9:00,1.035,https://monitoring.solaredge.com/solaredge-web/p/public?name=TELUS%20Spark,27/11/2017,5941482017-11-21 09:00:00,2017-11-21 09:00:00,2017,11,21,8,30,-11.7,1.39,0.026,0.62,19,368,37,4,4,-15.1,16,0,4,16,0.251,75.86,87.11,0.92,0.8,894,0.7000000000000001,150,2.2,0.0,0.0,273.0
20,Telus Spark,594148,220 ST GEORGES DR NE,21/11/2017 10:00,3.511,https://monitoring.solaredge.com/solaredge-web/p/public?name=TELUS%20Spark,27/11/2017,5941482017-11-21 10:00:00,2017-11-21 10:00:00,2017,11,21,9,30,-9.7,1.42,0.022,0.62,38,678,151,4,8,-14.5,96,25,4,100,0.25,68.03,80.41,0.91,0.8,893,0.6000000000000001,155,2.2,0.0,0.0,273.0
21,Telus Spark,594148,220 ST GEORGES DR NE,21/11/2017 11:00,3.876,https://monitoring.solaredge.com/solaredge-web/p/public?name=TELUS%20Spark,27/11/2017,5941482017-11-21 11:00:00,2017-11-21 11:00:00,2017,11,21,10,30,-6.9,1.41,0.021,0.62,49,799,253,4,8,-12.0,131,15,4,135,0.248,66.75,75.2,0.9,0.8,893,0.6000000000000001,158,2.4000000000000004,6.5901,5.0627,273.0
22,Telus Spark,594148,220 ST GEORGES DR NE,21/11/2017 12:00,4.395,https://monitoring.solaredge.com/solaredge-web/p/public?name=TELUS%20Spark,27/11/2017,5941482017-11-21 12:00:00,2017-11-21 12:00:00,2017,11,21,11,30,-4.6000000000000005,1.39,0.021,0.62,54,850,317,4,8,-9.5,118,4,4,119,0.246,68.39,71.99,0.9,0.8,892,0.6000000000000001,158,2.3000000000000003,5.9821,4.62,273.0
23,Telus Spark,594148,220 ST GEORGES DR NE,21/11/2017 13:00,2.802,https://monitoring.solaredge.com/solaredge-web/p/public?name=TELUS%20Spark,27/11/2017,5941482017-11-21 13:00:00,2017-11-21 13:00:00,2017,11,21,12,30,-3.3000000000000003,1.38,0.02,0.62,55,857,332,4,8,-7.4,128,4,4,129,0.244,73.34,71.11,0.9,0.8,891,0.7000000000000001,156,2.2,6.5378,5.0554,273.0
24,Telus Spark,594148,220 ST GEORGES DR NE,21/11/2017 14:00,2.05,https://monitoring.solaredge.com/solaredge-web/p/public?name=TELUS%20Spark,27/11/2017,5941482017-11-21 14:00:00,2017-11-21 14:00:00,2017,11,21,13,30,-2.8000000000000003,1.37,0.021,0.62,53,827,300,4,6,-5.9,84,1,4,84,0.243,79.28,72.64,0.91,0.8,890,0.8,148,2.1,4.1971,3.2383,273.0
25,Telus Spark,594148,220 ST GEORGES DR NE,21/11/2017 15:00,0.986,https://monitoring.solaredge.com/solaredge-web/p/public?name=TELUS%20Spark,27/11/2017,5941482017-11-21 15:00:00,2017-11-21 15:00:00,2017,11,21,14,30,-3.2,1.35,0.022,0.62,47,749,222,4,6,-5.1000000000000005,61,0,4,61,0.243,86.75,76.43,0.92,0.8,890,1.0,141,2.3000000000000003,2.9482,2.2598,273.0
26,Telus Spark,594148,220 ST GEORGES DR NE,21/11/2017 16:00,0.059,https://monitoring.solaredge.com/solaredge-web/p/public?name=TELUS%20Spark,27/11/2017,5941482017-11-21 16:00:00,2017-11-21 16:00:00,2017,11,21,15,30,-3.9,1.34,0.021,0.62,33,594,115,4,6,-5.4,38,0,4,38,0.242,89.37,82.11,0.92,0.8,889,1.2000000000000002,142,2.5,0.0,0.0,273.0
27,Telus Spark,594148,220 ST GEORGES DR NE,22/11/2017 8:00,0.233,https://monitoring.solaredge.com/solaredge-web/p/public?name=TELUS%20Spark,27/11/2017,5941482017-11-22 08:00:00,2017-11-22 08:00:00,2017,11,22,7,30,-0.9,1.45,0.013,0.62,0,0,0,4,4,-1.5,0,0,4,0,0.255,95.88,95.59,0.89,0.68,887,1.2000000000000002,281,1.4,0.0,0.0,273.0
28,Telus Spark,594148,220 ST GEORGES DR NE,22/11/2017 9:00,1.101,https://monitoring.solaredge.com/solaredge-web/p/public?name=TELUS%20Spark,27/11/2017,5941482017-11-22 09:00:00,2017-11-22 09:00:00,2017,11,22,8,30,-0.1,1.44,0.013,0.62,15,377,33,4,4,-1.3,10,0,4,10,0.253,91.95,87.33,0.89,0.68,888,1.2000000000000002,281,1.3,0.0,0.0,273.0
29,Telus Spark,594148,220 ST GEORGES DR NE,22/11/2017 10:00,2.557,https://monitoring.solaredge.com/solaredge-web/p/public?name=TELUS%20Spark,27/11/2017,5941482017-11-22 10:00:00,2017-11-22 10:00:00,2017,11,22,9,30,1.4,1.42,0.014,0.62,33,659,140,4,4,-0.5,22,0,4,22,0.252,87.39,80.63,0.89,0.68,888,1.2000000000000002,261,1.2000000000000002,0.0,0.0,273.0
30,Telus Spark,594148,220 ST GEORGES DR NE,22/11/2017 11:00,7.699,https://monitoring.solaredge.com/solaredge-web/p/public?name=TELUS%20Spark,27/11/2017,5941482017-11-22 11:00:00,2017-11-22 11:00:00,2017,11,22,10,30,2.8000000000000003,1.39,0.014,0.62,42,781,239,4,4,0.6000000000000001,137,6,4,138,0.251,85.29,75.42,0.9,0.68,888,1.1,235,1.4,6.7239,5.1634,273.0
31,Telus Spark,594148,220 ST GEORGES DR NE,22/11/2017 12:00,9.856,https://monitoring.solaredge.com/solaredge-web/p/public?name=TELUS%20Spark,27/11/2017,5941482017-11-22 12:00:00,2017-11-22 12:00:00,2017,11,22,11,30,3.7,1.34,0.018,0.62,50,824,302,4,4,1.4,190,20,4,196,0.25,84.91,72.21000000000001,0.91,0.68,888,1.1,220,1.7000000000000002,9.8327,7.5913,273.0
32,Telus Spark,594148,220 ST GEORGES DR NE,22/11/2017 13:00,9.416,https://monitoring.solaredge.com/solaredge-web/p/public?name=TELUS%20Spark,27/11/2017,5941482017-11-22 13:00:00,2017-11-22 13:00:00,2017,11,22,12,30,4.3,1.28,0.018,0.62,52,837,320,4,7,1.9,98,4,4,100,0.248,84.69,71.32000000000001,0.91,0.68,887,1.1,216,2.0,5.0583,3.9102,273.0
33,Telus Spark,594148,220 ST GEORGES DR NE,22/11/2017 14:00,5.905,https://monitoring.solaredge.com/solaredge-web/p/public?name=TELUS%20Spark,27/11/2017,5941482017-11-22 14:00:00,2017-11-22 14:00:00,2017,11,22,13,30,4.6000000000000005,1.24,0.019,0.62,50,813,290,4,4,2.5,138,2,4,138,0.246,86.33,72.84,0.91,0.68,887,1.1,218,2.0,6.8825,5.3085,273.0
34,Telus Spark,594148,220 ST GEORGES DR NE,22/11/2017 15:00,2.408,https://monitoring.solaredge.com/solaredge-web/p/public?name=TELUS%20Spark,27/11/2017,5941482017-11-22 15:00:00,2017-11-22 15:00:00,2017,11,22,14,30,4.3,1.22,0.022,0.62,45,737,216,4,7,2.8000000000000003,112,19,4,117,0.244,90.23,76.61,0.92,0.68,887,1.2000000000000002,222,1.9,5.6472,4.3271,273.0
35,Telus Spark,594148,220 ST GEORGES DR NE,22/11/2017 16:00,0.358,https://monitoring.solaredge.com/solaredge-web/p/public?name=TELUS%20Spark,27/11/2017,5941482017-11-22 16:00:00,2017-11-22 16:00:00,2017,11,22,15,30,3.3000000000000003,1.19,0.022,0.62,33,585,111,4,7,2.6,62,9,4,63,0.244,95.42,82.27,0.92,0.68,887,1.2000000000000002,227,1.9,0.0,0.0,273.0
36,Telus Spark,594148,220 ST GEORGES DR NE,23/11/2017 8:00,0.9,https://monitoring.solaredge.com/solaredge-web/p/public?name=TELUS%20Spark,27/11/2017,5941482017-11-23 08:00:00,2017-11-23 08:00:00,2017,11,23,7,30,3.7,1.44,0.014,0.62,0,0,0,4,8,2.9000000000000004,0,0,4,0,0.265,94.77,95.8,0.88,0.14,875,1.4,223,3.8,0.0,0.0,273.0
37,Telus Spark,594148,220 ST GEORGES DR NE,23/11/2017 9:00,2.257,https://monitoring.solaredge.com/solaredge-web/p/public?name=TELUS%20Spark,27/11/2017,5941482017-11-23 09:00:00,2017-11-23 09:00:00,2017,11,23,8,30,3.9,1.47,0.015,0.62,14,353,30,4,8,2.8000000000000003,9,0,4,9,0.265,92.25,87.53,0.88,0.14,875,1.4,229,3.5,0.0,0.0,273.0
38,Telus Spark,594148,220 ST GEORGES DR NE,23/11/2017 10:00,1.27,https://monitoring.solaredge.com/solaredge-web/p/public?name=TELUS%20Spark,27/11/2017,5941482017-11-23 10:00:00,2017-11-23 10:00:00,2017,11,23,9,30,4.800000000000001,1.44,0.017,0.62,31,644,134,4,4,2.9000000000000004,12,0,4,12,0.265,87.67,80.84,0.89,0.14,875,1.3,242,3.1,0.0,0.0,273.0
39,Telus Spark,594148,220 ST GEORGES DR NE,23/11/2017 11:00,3.385,https://monitoring.solaredge.com/solaredge-web/p/public?name=TELUS%20Spark,27/11/2017,5941482017-11-23 11:00:00,2017-11-23 11:00:00,2017,11,23,10,30,6.0,1.43,0.017,0.62,39,768,230,4,8,3.4000000000000004,41,0,4,41,0.267,83.33,75.64,0.89,0.14,875,1.2000000000000002,252,2.6,1.994,1.5306,273.0
40,Telus Spark,594148,220 ST GEORGES DR NE,23/11/2017 12:00,3.879,https://monitoring.solaredge.com/solaredge-web/p/public?name=TELUS%20Spark,27/11/2017,5941482017-11-23 12:00:00,2017-11-23 12:00:00,2017,11,23,11,30,6.6000000000000005,1.42,0.017,0.62,43,825,292,4,8,3.9,77,4,4,78,0.269,82.83,72.43,0.9,0.14,875,1.1,255,2.3000000000000003,3.905,3.0138,273.0
41,Telus Spark,594148,220 ST GEORGES DR NE,23/11/2017 13:00,3.598,https://monitoring.solaredge.com/solaredge-web/p/public?name=TELUS%20Spark,27/11/2017,5941482017-11-23 13:00:00,2017-11-23 13:00:00,2017,11,23,12,30,6.6000000000000005,1.31,0.02,0.62,46,836,311,4,8,3.3000000000000003,63,1,4,64,0.273,79.69,71.53,0.91,0.14,875,1.0,256,2.0,3.231,2.497,273.0
42,Telus Spark,594148,220 ST GEORGES DR NE,23/11/2017 14:00,0.757,https://monitoring.solaredge.com/solaredge-web/p/public?name=TELUS%20Spark,27/11/2017,5941482017-11-23 14:00:00,2017-11-23 14:00:00,2017,11,23,13,30,6.4,1.35,0.018,0.62,43,818,282,4,8,2.7,113,19,4,118,0.276,77.2,73.03,0.9,0.14,874,1.0,254,1.6,5.8746,4.5297,273.0
43,Telus Spark,594148,220 ST GEORGES DR NE,23/11/2017 15:00,0.625,https://monitoring.solaredge.com/solaredge-web/p/public?name=TELUS%20Spark,27/11/2017,5941482017-11-23 15:00:00,2017-11-23 15:00:00,2017,11,23,14,30,5.2,1.35,0.015,0.62,37,764,211,4,8,2.2,64,3,4,65,0.279,81.05,76.78,0.89,0.14,874,0.9,251,1.6,3.1335,2.4003,273.0
44,Telus Spark,594148,220 ST GEORGES DR NE,23/11/2017 16:00,0.027,https://monitoring.solaredge.com/solaredge-web/p/public?name=TELUS%20Spark,27/11/2017,5941482017-11-23 16:00:00,2017-11-23 16:00:00,2017,11,23,15,30,3.2,1.32,0.015,0.62,28,614,109,4,8,0.8,24,0,4,24,0.285,84.2,82.42,0.89,0.14,874,0.9,249,1.7000000000000002,0.0,0.0,273.0
45,Telus Spark,594148,220 ST GEORGES DR NE,24/11/2017 8:00,0.053,https://monitoring.solaredge.com/solaredge-web/p/public?name=TELUS%20Spark,27/11/2017,5941482017-11-24 08:00:00,2017-11-24 08:00:00,2017,11,24,7,30,0.8,1.28,0.018,0.62,0,0,0,0,6,-3.2,0,0,0,0,0.282,74.60000000000001,96.0,0.93,0.14,881,0.6000000000000001,253,2.2,0.0,0.0,273.0
46,Telus Spark,594148,220 ST GEORGES DR NE,24/11/2017 9:00,0.919,https://monitoring.solaredge.com/solaredge-web/p/public?name=TELUS%20Spark,27/11/2017,5941482017-11-24 09:00:00,2017-11-24 09:00:00,2017,11,24,8,30,1.4,1.32,0.019,0.62,15,350,29,7,4,-2.9000000000000004,9,0,7,9,0.281,73.31,87.73,0.92,0.14,881,0.7000000000000001,255,2.7,0.0,0.0,273.0
47,Telus Spark,594148,220 ST GEORGES DR NE,24/11/2017 10:00,1.889,https://monitoring.solaredge.com/solaredge-web/p/public?name=TELUS%20Spark,27/11/2017,5941482017-11-24 10:00:00,2017-11-24 10:00:00,2017,11,24,9,30,2.5,1.42,0.016,0.62,31,668,135,7,8,-2.4000000000000004,64,10,7,66,0.279,70.09,81.05,0.91,0.14,882,0.7000000000000001,257,3.2,0.0,0.0,273.0
48,Telus Spark,594148,220 ST GEORGES DR NE,24/11/2017 11:00,5.418,https://monitoring.solaredge.com/solaredge-web/p/public?name=TELUS%20Spark,27/11/2017,5941482017-11-24 11:00:00,2017-11-24 11:00:00,2017,11,24,10,30,3.7,1.42,0.016,0.62,39,791,232,7,8,-1.9,96,402,7,195,0.277,67.01,75.85000000000001,0.91,0.14,883,0.7000000000000001,259,3.4000000000000004,9.4673,7.2644,273.0
49,Telus Spark,594148,220 ST GEORGES DR NE,24/11/2017 12:00,7.823,https://monitoring.solaredge.com/solaredge-web/p/public?name=TELUS%20Spark,27/11/2017,5941482017-11-24 12:00:00,2017-11-24 12:00:00,2017,11,24,11,30,4.7,1.35,0.023,0.62,47,830,295,0,1,-1.5,47,830,0,295,0.275,64.04,72.63,0.92,0.14,883,0.7000000000000001,262,3.4000000000000004,14.7413,11.3737,273.0
50,Telus Spark,594148,220 ST GEORGES DR NE,24/11/2017 13:00,5.512,https://monitoring.solaredge.com/solaredge-web/p/public?name=TELUS%20Spark,27/11/2017,5941482017-11-24 13:00:00,2017-11-24 13:00:00,2017,11,24,12,30,5.2,1.34,0.02,0.62,47,849,313,7,8,-1.7000000000000002,105,534,7,272,0.272,61.09,71.72,0.92,0.14,884,0.7000000000000001,269,3.2,13.7077,10.5906,273.0
51,Telus Spark,594148,220 ST GEORGES DR NE,24/11/2017 14:00,3.98,https://monitoring.solaredge.com/solaredge-web/p/public?name=TELUS%20Spark,27/11/2017,5941482017-11-24 14:00:00,2017-11-24 14:00:00,2017,11,24,13,30,4.9,1.34,0.02,0.62,45,827,284,7,8,-2.3000000000000003,144,195,7,201,0.269,59.51,73.21000000000001,0.92,0.14,884,0.7000000000000001,279,2.6,9.99,7.7008,273.0
52,Telus Spark,594148,220 ST GEORGES DR NE,24/11/2017 15:00,1.439,https://monitoring.solaredge.com/solaredge-web/p/public?name=TELUS%20Spark,27/11/2017,5941482017-11-24 15:00:00,2017-11-24 15:00:00,2017,11,24,14,30,3.9,1.34,0.025,0.62,42,749,211,7,8,-2.2,114,105,7,138,0.268,64.27,76.94,0.92,0.14,885,0.7000000000000001,283,1.8,6.6454,5.0888,273.0
53,Telus Spark,594148,220 ST GEORGES DR NE,24/11/2017 16:00,0.173,https://monitoring.solaredge.com/solaredge-web/p/public?name=TELUS%20Spark,27/11/2017,5941482017-11-24 16:00:00,2017-11-24 16:00:00,2017,11,24,15,30,1.8,1.32,0.024,0.62,31,596,108,7,8,-2.9000000000000004,67,44,7,73,0.267,71.19,82.56,0.92,0.14,885,0.7000000000000001,276,1.4,0.0,0.0,273.0
54,Telus Spark,594148,220 ST GEORGES DR NE,25/11/2017 8:00,0.348,https://monitoring.solaredge.com/solaredge-web/p/public?name=TELUS%20Spark,27/11/2017,5941482017-11-25 08:00:00,2017-11-25 08:00:00,2017,11,25,7,30,0.6000000000000001,1.3,0.017,0.62,0,0,0,0,8,-4.0,0,0,0,0,0.264,71.36,96.2,0.91,0.14,887,0.7000000000000001,247,3.6,0.0,0.0,273.0
55,Telus Spark,594148,220 ST GEORGES DR NE,25/11/2017 9:00,1.488,https://monitoring.solaredge.com/solaredge-web/p/public?name=TELUS%20Spark,27/11/2017,5941482017-11-25 09:00:00,2017-11-25 09:00:00,2017,11,25,8,30,0.8,1.33,0.014,0.62,14,357,27,7,8,-4.1000000000000005,15,1,7,15,0.263,69.71000000000001,87.91,0.9,0.14,887,0.7000000000000001,250,3.8,0.0,0.0,273.0
56,Telus Spark,594148,220 ST GEORGES DR NE,25/11/2017 10:00,2.033,https://monitoring.solaredge.com/solaredge-web/p/public?name=TELUS%20Spark,27/11/2017,5941482017-11-25 10:00:00,2017-11-25 10:00:00,2017,11,25,9,30,2.1,1.34,0.014,0.62,30,675,133,7,8,-3.7,74,221,7,107,0.262,65.3,81.26,0.9,0.14,887,0.6000000000000001,253,4.1000000000000005,0.0,0.0,273.0
57,Telus Spark,594148,220 ST GEORGES DR NE,25/11/2017 11:00,3.914,https://monitoring.solaredge.com/solaredge-web/p/public?name=TELUS%20Spark,27/11/2017,5941482017-11-25 11:00:00,2017-11-25 11:00:00,2017,11,25,10,30,3.6,1.33,0.015,0.62,38,797,230,7,8,-3.0,130,138,7,164,0.262,61.99,76.06,0.9,0.14,888,0.6000000000000001,255,4.0,7.9489,6.0969,273.0
58,Telus Spark,594148,220 ST GEORGES DR NE,25/11/2017 12:00,4.477,https://monitoring.solaredge.com/solaredge-web/p/public?name=TELUS%20Spark,27/11/2017,5941482017-11-25 12:00:00,2017-11-25 12:00:00,2017,11,25,11,30,4.7,1.34,0.015,0.62,42,850,293,7,8,-2.3000000000000003,96,559,7,261,0.262,60.28,72.84,0.9,0.14,888,0.6000000000000001,256,3.6,13.0168,10.0399,273.0
59,Telus Spark,594148,220 ST GEORGES DR NE,25/11/2017 13:00,2.638,https://monitoring.solaredge.com/solaredge-web/p/public?name=TELUS%20Spark,27/11/2017,5941482017-11-25 13:00:00,2017-11-25 13:00:00,2017,11,25,12,30,5.300000000000001,1.31,0.016,0.62,44,861,311,7,8,-2.0,109,498,7,263,0.262,59.53,71.91,0.91,0.14,888,0.6000000000000001,257,3.0,13.2307,10.2193,273.0
60,Telus Spark,594148,220 ST GEORGES DR NE,25/11/2017 14:00,4.189,https://monitoring.solaredge.com/solaredge-web/p/public?name=TELUS%20Spark,27/11/2017,5941482017-11-25 14:00:00,2017-11-25 14:00:00,2017,11,25,13,30,5.2,1.32,0.016,0.62,42,832,280,7,6,-1.8,129,37,7,139,0.262,60.77,73.39,0.91,0.14,888,0.7000000000000001,257,2.1,6.897,5.315,273.0
61,Telus Spark,594148,220 ST GEORGES DR NE,25/11/2017 15:00,1.605,https://monitoring.solaredge.com/solaredge-web/p/public?name=TELUS%20Spark,27/11/2017,5941482017-11-25 15:00:00,2017-11-25 15:00:00,2017,11,25,14,30,3.8,1.34,0.015,0.62,37,769,209,7,8,-1.2000000000000002,82,536,7,202,0.262,69.92,77.10000000000001,0.91,0.14,887,0.7000000000000001,254,1.4,9.7169,7.4387,273.0
62,Telus Spark,594148,220 ST GEORGES DR NE,25/11/2017 16:00,0.103,https://monitoring.solaredge.com/solaredge-web/p/public?name=TELUS%20Spark,27/11/2017,5941482017-11-25 16:00:00,2017-11-25 16:00:00,2017,11,25,15,30,1.5,1.36,0.014,0.62,27,613,105,7,7,-1.5,62,182,7,86,0.263,80.35000000000001,82.7,0.91,0.14,887,0.8,250,1.2000000000000002,0.0,0.0,273.0
63,Telus Spark,594148,220 ST GEORGES DR NE,26/11/2017 8:00,0.183,https://monitoring.solaredge.com/solaredge-web/p/public?name=TELUS%20Spark,27/11/2017,5941482017-11-26 08:00:00,2017-11-26 08:00:00,2017,11,26,7,30,-1.7000000000000002,1.37,0.02,0.62,0,0,0,0,1,-3.8,0,0,0,0,0.27,85.46000000000001,96.39,0.92,0.14,880,1.1,187,1.9,0.0,0.0,273.0
64,Telus Spark,594148,220 ST GEORGES DR NE,26/11/2017 9:00,0.887,https://monitoring.solaredge.com/solaredge-web/p/public?name=TELUS%20Spark,27/11/2017,5941482017-11-26 09:00:00,2017-11-26 09:00:00,2017,11,26,8,30,-0.3,1.39,0.018,0.62,13,315,24,0,1,-3.0,13,315,0,24,0.269,82.13,88.10000000000001,0.91,0.14,879,1.0,186,2.3000000000000003,0.0,0.0,273.0
65,Telus Spark,594148,220 ST GEORGES DR NE,26/11/2017 10:00,1.316,https://monitoring.solaredge.com/solaredge-web/p/public?name=TELUS%20Spark,27/11/2017,5941482017-11-26 10:00:00,2017-11-26 10:00:00,2017,11,26,9,30,2.1,1.43,0.016,0.62,30,645,126,1,1,-1.6,30,645,1,126,0.27,76.71000000000001,81.46000000000001,0.9,0.14,878,0.9,185,2.9000000000000004,0.0,0.0,273.0
66,Telus Spark,594148,220 ST GEORGES DR NE,26/11/2017 11:00,4.361,https://monitoring.solaredge.com/solaredge-web/p/public?name=TELUS%20Spark,27/11/2017,5941482017-11-26 11:00:00,2017-11-26 11:00:00,2017,11,26,10,30,4.2,1.4,0.018,0.62,39,774,223,0,1,-0.4,39,774,0,223,0.271,71.83,76.26,0.9,0.14,877,0.8,182,3.1,10.7917,8.2744,273.0
67,Telus Spark,594148,220 ST GEORGES DR NE,26/11/2017 12:00,4.669,https://monitoring.solaredge.com/solaredge-web/p/public?name=TELUS%20Spark,27/11/2017,5941482017-11-26 12:00:00,2017-11-26 12:00:00,2017,11,26,11,30,5.9,1.35,0.017,0.62,43,838,288,7,8,0.5,143,169,7,193,0.269,68.41,73.03,0.91,0.14,876,0.7000000000000001,180,3.1,9.6085,7.4088,273.0
68,Telus Spark,594148,220 ST GEORGES DR NE,26/11/2017 13:00,4.479,https://monitoring.solaredge.com/solaredge-web/p/public?name=TELUS%20Spark,27/11/2017,5941482017-11-26 13:00:00,2017-11-26 13:00:00,2017,11,26,12,30,6.5,1.35,0.019,0.62,46,848,306,7,8,1.3,141,275,7,225,0.267,69.62,72.10000000000001,0.92,0.14,875,0.7000000000000001,182,2.8000000000000003,11.2991,8.7249,273.0
69,Telus Spark,594148,220 ST GEORGES DR NE,26/11/2017 14:00,2.418,https://monitoring.solaredge.com/solaredge-web/p/public?name=TELUS%20Spark,27/11/2017,5941482017-11-26 14:00:00,2017-11-26 14:00:00,2017,11,26,13,30,6.2,1.34,0.022,0.62,45,814,276,7,8,1.8,122,303,7,208,0.265,73.43,73.56,0.92,0.14,874,0.8,187,2.5,10.3044,7.9386,273.0
70,Telus Spark,594148,220 ST GEORGES DR NE,26/11/2017 15:00,1.562,https://monitoring.solaredge.com/solaredge-web/p/public?name=TELUS%20Spark,27/11/2017,5941482017-11-26 15:00:00,2017-11-26 15:00:00,2017,11,26,14,30,5.6000000000000005,1.34,0.024,0.62,41,736,203,7,4,1.8,109,246,7,163,0.265,76.44,77.25,0.93,0.14,873,0.9,193,2.5,7.8333,5.995,273.0
71,Telus Spark,594148,220 ST GEORGES DR NE,26/11/2017 16:00,0.091,https://monitoring.solaredge.com/solaredge-web/p/public?name=TELUS%20Spark,27/11/2017,5941482017-11-26 16:00:00,2017-11-26 16:00:00,2017,11,26,15,30,4.9,1.34,0.025,0.62,30,574,102,7,4,1.7000000000000002,66,16,7,68,0.265,79.51,82.83,0.93,0.14,872,0.9,201,2.7,0.0,0.0,273.0
72,Telus Spark,594148,220 ST GEORGES DR NE,27/11/2017 8:00,0.345,https://monitoring.solaredge.com/solaredge-web/p/public?name=TELUS%20Spark,27/11/2017,5941482017-11-27 08:00:00,2017-11-27 08:00:00,2017,11,27,7,30,-0.6000000000000001,1.54,0.017,0.62,0,0,0,0,8,-10.3,0,0,0,0,0.338,47.91,96.59,0.89,0.14,875,0.4,255,4.3,0.0,0.0,273.0
73,Telus Spark,594148,220 ST GEORGES DR NE,27/11/2017 11:00,4.189,https://monitoring.solaredge.com/solaredge-web/p/public?name=TELUS%20Spark,27/11/2017,5941482017-11-27 11:00:00,2017-11-27 11:00:00,2017,11,27,10,30,2.7,1.65,0.02,0.62,40,797,226,0,0,-8.200000000000001,40,797,0,226,0.336,44.53,76.45,0.88,0.14,877,0.4,262,5.800000000000001,10.9212,8.3707,273.0
74,Telus Spark,594148,220 ST GEORGES DR NE,27/11/2017 12:00,6.928,https://monitoring.solaredge.com/solaredge-web/p/public?name=TELUS%20Spark,27/11/2017,5941482017-11-27 12:00:00,2017-11-27 12:00:00,2017,11,27,11,30,3.7,1.6,0.019,0.62,44,855,290,0,1,-7.7,44,855,0,290,0.334,43.12,73.22,0.89,0.14,878,0.4,270,6.1000000000000005,14.4121,11.1094,273.0
75,Telus Spark,594148,220 ST GEORGES DR NE,27/11/2017 15:00,0.746,https://monitoring.solaredge.com/solaredge-web/p/public?name=TELUS%20Spark,27/11/2017,5941482017-11-27 15:00:00,2017-11-27 15:00:00,2017,11,27,14,30,2.7,1.42,0.019,0.62,39,792,211,0,0,-11.0,39,792,0,211,0.33,35.79,77.39,0.9,0.14,881,0.3,284,5.6000000000000005,10.1313,7.7518,273.0
76,Telus Spark,594148,220 ST GEORGES DR NE,27/11/2017 16:00,0.101,https://monitoring.solaredge.com/solaredge-web/p/public?name=TELUS%20Spark,27/11/2017,5941482017-11-27 16:00:00,2017-11-27 16:00:00,2017,11,27,15,30,1.1,1.37,0.02,0.62,28,619,104,0,1,-10.9,28,619,0,104,0.328,40.48,82.95,0.89,0.14,882,0.4,285,4.0,0.0,0.0,273.0
77,Telus Spark,594148,220 ST GEORGES DR NE,28/11/2017 8:00,0.24,https://monitoring.solaredge.com/solaredge-web/p/public?name=TELUS%20Spark,27/11/2017,5941482017-11-28 08:00:00,2017-11-28 08:00:00,2017,11,28,7,30,-1.9,1.24,0.042,0.62,0,0,0,4,8,-8.0,0,0,4,0,0.287,63.14,96.77,0.94,0.14,886,0.6000000000000001,229,2.3000000000000003,0.0,0.0,273.0
78,Telus Spark,594148,220 ST GEORGES DR NE,28/11/2017 9:00,1.338,https://monitoring.solaredge.com/solaredge-web/p/public?name=TELUS%20Spark,27/11/2017,5941482017-11-28 09:00:00,2017-11-28 09:00:00,2017,11,28,8,30,-1.4,1.24,0.041,0.62,14,225,20,4,8,-7.7,11,0,4,11,0.286,62.17,88.45,0.94,0.14,885,0.6000000000000001,221,2.3000000000000003,0.0,0.0,273.0
79,Telus Spark,594148,220 ST GEORGES DR NE,28/11/2017 10:00,2.99,https://monitoring.solaredge.com/solaredge-web/p/public?name=TELUS%20Spark,27/11/2017,5941482017-11-28 10:00:00,2017-11-28 10:00:00,2017,11,28,9,30,-0.4,1.25,0.04,0.62,36,586,119,4,8,-7.4,78,61,4,86,0.284,59.27,81.84,0.94,0.14,885,0.6000000000000001,216,2.4000000000000004,0.0,0.0,273.0
80,Telus Spark,594148,220 ST GEORGES DR NE,28/11/2017 11:00,4.436,https://monitoring.solaredge.com/solaredge-web/p/public?name=TELUS%20Spark,27/11/2017,5941482017-11-28 11:00:00,2017-11-28 11:00:00,2017,11,28,10,30,0.7000000000000001,1.24,0.039,0.62,47,732,217,4,8,-7.1000000000000005,103,346,4,183,0.284,55.97,76.64,0.94,0.14,885,0.6000000000000001,212,2.5,8.8309,6.7662,273.0
81,Telus Spark,594148,220 ST GEORGES DR NE,28/11/2017 12:00,4.35,https://monitoring.solaredge.com/solaredge-web/p/public?name=TELUS%20Spark,27/11/2017,5941482017-11-28 12:00:00,2017-11-28 12:00:00,2017,11,28,11,30,1.6,1.24,0.036,0.62,52,792,278,4,8,-6.6000000000000005,137,265,4,213,0.284,54.32,73.41,0.94,0.14,885,0.7000000000000001,208,2.6,10.5668,8.1427,273.0
82,Telus Spark,594148,220 ST GEORGES DR NE,28/11/2017 13:00,4.405,https://monitoring.solaredge.com/solaredge-web/p/public?name=TELUS%20Spark,27/11/2017,5941482017-11-28 13:00:00,2017-11-28 13:00:00,2017,11,28,12,30,2.2,1.24,0.032,0.62,52,809,296,4,6,-6.2,111,21,4,118,0.283,53.94,72.45,0.95,0.14,884,0.8,209,2.7,5.9064,4.5584,273.0
83,Telus Spark,594148,220 ST GEORGES DR NE,28/11/2017 14:00,4.136,https://monitoring.solaredge.com/solaredge-web/p/public?name=TELUS%20Spark,27/11/2017,5941482017-11-28 14:00:00,2017-11-28 14:00:00,2017,11,28,13,30,2.3000000000000003,1.23,0.029,0.62,48,792,269,4,6,-5.9,132,65,4,150,0.283,54.85,73.87,0.95,0.14,883,0.8,210,2.5,7.4099,5.7057,273.0
84,Telus Spark,594148,220 ST GEORGES DR NE,28/11/2017 15:00,2.076,https://monitoring.solaredge.com/solaredge-web/p/public?name=TELUS%20Spark,27/11/2017,5941482017-11-28 15:00:00,2017-11-28 15:00:00,2017,11,28,14,30,1.8,1.2,0.028,0.62,42,722,198,4,8,-5.300000000000001,114,122,4,141,0.286,59.15,77.53,0.95,0.14,883,0.8,206,2.1,6.7646,5.1745,273.0
85,Telus Spark,594148,220 ST GEORGES DR NE,28/11/2017 16:00,0.166,https://monitoring.solaredge.com/solaredge-web/p/public?name=TELUS%20Spark,27/11/2017,5941482017-11-28 16:00:00,2017-11-28 16:00:00,2017,11,28,15,30,1.1,1.19,0.029,0.62,31,554,98,4,8,-5.1000000000000005,63,31,4,66,0.289,63.08,83.07000000000001,0.95,0.14,882,0.8,202,2.0,0.0,0.0,273.0
86,Telus Spark,594148,220 ST GEORGES DR NE,29/11/2017 8:00,0.206,https://monitoring.solaredge.com/solaredge-web/p/public?name=TELUS%20Spark,27/11/2017,5941482017-11-29 08:00:00,2017-11-29 08:00:00,2017,11,29,7,30,-2.1,1.55,0.02,0.62,0,0,0,0,1,-6.5,0,0,0,0,0.324,71.8,96.96,0.9,0.14,887,0.5,274,3.0,0.0,0.0,273.0
87,Telus Spark,594148,220 ST GEORGES DR NE,29/11/2017 9:00,1.212,https://monitoring.solaredge.com/solaredge-web/p/public?name=TELUS%20Spark,27/11/2017,5941482017-11-29 09:00:00,2017-11-29 09:00:00,2017,11,29,8,30,-1.5,1.52,0.019,0.62,12,302,19,0,1,-6.7,12,302,0,19,0.319,67.87,88.62,0.9,0.14,888,0.5,274,3.1,0.0,0.0,273.0
88,Telus Spark,594148,220 ST GEORGES DR NE,29/11/2017 10:00,1.158,https://monitoring.solaredge.com/solaredge-web/p/public?name=TELUS%20Spark,27/11/2017,5941482017-11-29 10:00:00,2017-11-29 10:00:00,2017,11,29,9,30,0.1,1.47,0.018,0.62,30,647,120,0,1,-6.4,30,647,0,120,0.317,61.71,82.02,0.9,0.14,890,0.5,272,3.5,0.0,0.0,273.0
89,Telus Spark,594148,220 ST GEORGES DR NE,29/11/2017 11:00,2.711,https://monitoring.solaredge.com/solaredge-web/p/public?name=TELUS%20Spark,27/11/2017,5941482017-11-29 11:00:00,2017-11-29 11:00:00,2017,11,29,10,30,1.8,1.43,0.018,0.62,39,793,220,0,0,-5.9,39,793,0,220,0.314,56.63,76.82000000000001,0.89,0.14,890,0.4,268,3.7,10.6029,8.1211,273.0
90,Telus Spark,594148,220 ST GEORGES DR NE,29/11/2017 12:00,4.479,https://monitoring.solaredge.com/solaredge-web/p/public?name=TELUS%20Spark,27/11/2017,5941482017-11-29 12:00:00,2017-11-29 12:00:00,2017,11,29,11,30,3.2,1.38,0.016,0.62,42,854,283,0,1,-5.6000000000000005,42,854,0,283,0.313,52.58,73.58,0.89,0.14,891,0.4,268,3.9,14.0173,10.7987,273.0
91,Telus Spark,594148,220 ST GEORGES DR NE,29/11/2017 13:00,3.82,https://monitoringpublic.solaredge.com/solaredge-web/p/site/public?name=TELUS%20Spark,27/11/2017,5941482017-11-29 13:00:00,2017-11-29 13:00:00,2017,11,29,12,30,3.9,1.32,0.017,0.62,44,866,302,0,0,-5.800000000000001,44,866,0,302,0.312,49.19,72.62,0.9,0.14,891,0.4,270,4.0,15.0926,11.6449,273.0
92,Telus Spark,594148,220 ST GEORGES DR NE,29/11/2017 14:00,3.539,https://monitoringpublic.solaredge.com/solaredge-web/p/site/public?name=TELUS%20Spark,27/11/2017,5941482017-11-29 14:00:00,2017-11-29 14:00:00,2017,11,29,13,30,3.8,1.28,0.02,0.62,44,838,275,7,7,-6.1000000000000005,93,649,7,272,0.31,48.34,74.02,0.91,0.14,892,0.4,269,3.7,13.4181,10.3295,273.0
93,Telus Spark,594148,220 ST GEORGES DR NE,29/11/2017 15:00,4.855,https://monitoringpublic.solaredge.com/solaredge-web/p/site/public?name=TELUS%20Spark,27/11/2017,5941482017-11-29 15:00:00,2017-11-29 15:00:00,2017,11,29,14,30,2.7,1.27,0.02,0.62,39,758,201,7,8,-6.1000000000000005,105,242,7,157,0.308,52.14,77.66,0.92,0.14,892,0.5,267,3.0,7.5267,5.7561,273.0
94,Telus Spark,594148,220 ST GEORGES DR NE,29/11/2017 16:00,0.448,https://monitoringpublic.solaredge.com/solaredge-web/p/site/public?name=TELUS%20Spark,27/11/2017,5941482017-11-29 16:00:00,2017-11-29 16:00:00,2017,11,29,15,30,1.2000000000000002,1.27,0.022,0.62,29,591,99,7,6,-6.1000000000000005,51,8,7,52,0.308,58.29,83.18,0.92,0.14,892,0.5,266,2.8000000000000003,0.0,0.0,273.0
95,Telus Spark,594148,220 ST GEORGES DR NE,2/12/2017 8:00,1.842,https://monitoringpublic.solaredge.com/solaredge-web/p/site/public?name=TELUS%20Spark,27/11/2017,5941482017-12-02 08:00:00,2017-12-02 08:00:00,2017,12,2,7,30,-3.8,1.25,0.031,0.63,0,0,0,0,1,-6.6000000000000005,0,0,0,0,0.372,80.59,97.48,0.94,0.14,883,0.6000000000000001,255,1.6,0.0,0.0,273.0
96,Telus Spark,594148,220 ST GEORGES DR NE,2/12/2017 9:00,6.592,https://monitoringpublic.solaredge.com/solaredge-web/p/site/public?name=TELUS%20Spark,27/11/2017,5941482017-12-02 09:00:00,2017-12-02 09:00:00,2017,12,2,8,30,-3.6,1.29,0.027,0.63,0,0,0,7,8,-6.6000000000000005,0,0,7,0,0.373,79.73,89.10000000000001,0.93,0.14,883,0.5,257,1.8,0.0,0.0,273.0
97,Telus Spark,594148,220 ST GEORGES DR NE,2/12/2017 10:00,4.921,https://monitoringpublic.solaredge.com/solaredge-web/p/site/public?name=TELUS%20Spark,27/11/2017,5941482017-12-02 10:00:00,2017-12-02 10:00:00,2017,12,2,9,30,-2.2,1.32,0.025,0.63,30,606,109,7,8,-6.4,69,40,7,75,0.373,72.8,82.55,0.92,0.14,884,0.5,259,2.3000000000000003,0.0,0.0,273.0
98,Telus Spark,594148,220 ST GEORGES DR NE,2/12/2017 11:00,6.761,https://monitoringpublic.solaredge.com/solaredge-web/p/site/public?name=TELUS%20Spark,27/11/2017,5941482017-12-02 11:00:00,2017-12-02 11:00:00,2017,12,2,10,30,-0.3,1.33,0.024,0.63,40,755,206,0,0,-5.9,40,755,0,206,0.373,65.77,77.34,0.92,0.14,884,0.5,261,2.9000000000000004,9.8943,7.5711,273.0
99,Telus Spark,594148,220 ST GEORGES DR NE,2/12/2017 12:00,12.377,https://monitoringpublic.solaredge.com/solaredge-web/p/site/public?name=TELUS%20Spark,27/11/2017,5941482017-12-02 12:00:00,2017-12-02 12:00:00,2017,12,2,11,30,1.1,1.36,0.027,0.63,47,811,269,0,0,-6.1000000000000005,47,811,0,269,0.374,58.9,74.08,0.92,0.14,884,0.5,269,3.5,13.2628,10.2089,273.0
100,Telus Spark,594148,220 ST GEORGES DR NE,2/12/2017 13:00,8.162,https://monitoringpublic.solaredge.com/solaredge-web/p/site/public?name=TELUS%20Spark,27/11/2017,5941482017-12-02 13:00:00,2017-12-02 13:00:00,2017,12,2,12,30,1.8,1.38,0.031,0.63,49,820,288,0,0,-6.7,49,820,0,288,0.375,53.31,73.07000000000001,0.91,0.14,885,0.5,284,3.9,14.3327,11.0508,273.0
101,Telus Spark,594148,220 ST GEORGES DR NE,2/12/2017 14:00,4.559,https://monitoringpublic.solaredge.com/solaredge-web/p/site/public?name=TELUS%20Spark,27/11/2017,5941482017-12-02 14:00:00,2017-12-02 14:00:00,2017,12,2,13,30,1.8,1.39,0.033,0.63,48,793,261,0,0,-7.5,48,793,0,261,0.377,50.05,74.43,0.91,0.14,885,0.5,298,3.7,12.8276,9.868,273.0
102,Telus Spark,594148,220 ST GEORGES DR NE,2/12/2017 15:00,2.844,https://monitoringpublic.solaredge.com/solaredge-web/p/site/public?name=TELUS%20Spark,27/11/2017,5941482017-12-02 15:00:00,2017-12-02 15:00:00,2017,12,2,14,30,0.7000000000000001,1.39,0.031,0.63,41,725,192,1,1,-7.6,41,725,1,192,0.379,54.01,78.0,0.92,0.14,885,0.5,313,2.6,9.1885,7.0226,273.0
103,Telus Spark,594148,220 ST GEORGES DR NE,2/12/2017 16:00,0.339,https://monitoringpublic.solaredge.com/solaredge-web/p/site/public?name=TELUS%20Spark,27/11/2017,5941482017-12-02 16:00:00,2017-12-02 16:00:00,2017,12,2,15,30,-1.7000000000000002,1.42,0.033,0.63,29,550,92,0,1,-6.9,29,550,0,92,0.38,67.86,83.46000000000001,0.92,0.14,885,0.5,334,1.5,0.0,0.0,273.0
104,Telus Spark,594148,220 ST GEORGES DR NE,3/12/2017 8:00,0.383,https://monitoringpublic.solaredge.com/solaredge-web/p/site/public?name=TELUS%20Spark,27/11/2017,5941482017-12-03 08:00:00,2017-12-03 08:00:00,2017,12,3,7,30,-7.6,1.53,0.045,0.63,0,0,0,0,8,-11.6,0,0,0,0,0.347,72.89,97.65,0.92,0.14,883,0.5,324,2.3000000000000003,0.0,0.0,273.0
105,Telus Spark,594148,220 ST GEORGES DR NE,3/12/2017 9:00,2.949,https://monitoringpublic.solaredge.com/solaredge-web/p/site/public?name=TELUS%20Spark,27/11/2017,5941482017-12-03 09:00:00,2017-12-03 09:00:00,2017,12,3,8,30,-7.1000000000000005,1.57,0.047,0.63,0,0,0,7,8,-11.7,0,0,7,0,0.354,69.49,89.24,0.92,0.14,884,0.5,324,2.7,0.0,0.0,273.0
106,Telus Spark,594148,220 ST GEORGES DR NE,3/12/2017 10:00,5.441,https://monitoringpublic.solaredge.com/solaredge-web/p/site/public?name=TELUS%20Spark,27/11/2017,5941482017-12-03 10:00:00,2017-12-03 10:00:00,2017,12,3,9,30,-5.9,1.58,0.046,0.63,33,553,104,0,1,-11.5,33,553,0,104,0.361,64.62,82.71000000000001,0.92,0.14,885,0.5,326,3.0,0.0,0.0,273.0
107,Telus Spark,594148,220 ST GEORGES DR NE,3/12/2017 11:00,12.11,https://monitoringpublic.solaredge.com/solaredge-web/p/site/public?name=TELUS%20Spark,27/11/2017,5941482017-12-03 11:00:00,2017-12-03 11:00:00,2017,12,3,10,30,-4.2,1.57,0.041,0.63,45,729,203,0,0,-11.1,45,729,0,203,0.366,58.870000000000005,77.5,0.92,0.14,885,0.4,331,3.2,9.7408,7.4515,273.0
108,Telus Spark,594148,220 ST GEORGES DR NE,3/12/2017 12:00,15.009,https://monitoringpublic.solaredge.com/solaredge-web/p/site/public?name=TELUS%20Spark,27/11/2017,5941482017-12-03 12:00:00,2017-12-03 12:00:00,2017,12,3,11,30,-2.7,1.57,0.033,0.63,48,822,272,7,4,-10.9,153,21,7,159,0.368,53.47,74.23,0.91,0.14,885,0.3,341,3.3000000000000003,7.8287,6.0245,273.0
109,Telus Spark,594148,220 ST GEORGES DR NE,3/12/2017 13:00,11.301,https://monitoringpublic.solaredge.com/solaredge-web/p/site/public?name=TELUS%20Spark,27/11/2017,5941482017-12-03 13:00:00,2017-12-03 13:00:00,2017,12,3,12,30,-1.8,1.56,0.031,0.63,49,843,293,0,0,-11.1,49,843,0,293,0.367,49.19,73.21000000000001,0.9,0.14,885,0.3,350,3.3000000000000003,14.5625,11.2255,273.0
110,Telus Spark,594148,220 ST GEORGES DR NE,3/12/2017 14:00,6.345,https://monitoringpublic.solaredge.com/solaredge-web/p/site/public?name=TELUS%20Spark,27/11/2017,5941482017-12-03 14:00:00,2017-12-03 14:00:00,2017,12,3,13,30,-1.6,1.57,0.032,0.63,48,819,266,0,1,-11.5,48,819,0,266,0.363,47.02,74.55,0.9,0.14,886,0.3,355,3.2,13.0593,10.0441,273.0
111,Telus Spark,594148,220 ST GEORGES DR NE,3/12/2017 15:00,4.745,https://monitoringpublic.solaredge.com/solaredge-web/p/site/public?name=TELUS%20Spark,27/11/2017,5941482017-12-03 15:00:00,2017-12-03 15:00:00,2017,12,3,14,30,-2.6,1.58,0.036,0.63,43,739,195,7,4,-11.6,106,243,7,156,0.358,50.19,78.10000000000001,0.9,0.14,886,0.3,358,2.4000000000000004,7.4621,5.7022,273.0
112,Telus Spark,594148,220 ST GEORGES DR NE,3/12/2017 16:00,0.336,https://monitoringpublic.solaredge.com/solaredge-web/p/site/public?name=TELUS%20Spark,27/11/2017,5941482017-12-03 16:00:00,2017-12-03 16:00:00,2017,12,3,15,30,-4.9,1.6,0.04,0.63,30,545,92,7,4,-10.9,51,1,7,51,0.352,62.86,83.54,0.91,0.14,887,0.4,181,1.5,0.0,0.0,273.0
113,Telus Spark,594148,220 ST GEORGES DR NE,4/12/2017 8:00,0.77,https://monitoringpublic.solaredge.com/solaredge-web/p/site/public?name=TELUS%20Spark,27/11/2017,5941482017-12-04 08:00:00,2017-12-04 08:00:00,2017,12,4,7,30,-8.3,1.27,0.031,0.63,0,0,0,0,8,-15.6,0,0,0,0,0.295,55.48,97.81,0.94,0.14,894,0.5,286,2.8000000000000003,0.0,0.0,273.0
114,Telus Spark,594148,220 ST GEORGES DR NE,4/12/2017 9:00,6.241,https://monitoringpublic.solaredge.com/solaredge-web/p/site/public?name=TELUS%20Spark,27/11/2017,5941482017-12-04 09:00:00,2017-12-04 09:00:00,2017,12,4,8,30,-7.5,1.27,0.033,0.63,0,0,0,7,8,-15.2,0,0,7,0,0.291,54.11,89.38,0.94,0.14,895,0.6000000000000001,287,3.0,0.0,0.0,273.0
115,Telus Spark,594148,220 ST GEORGES DR NE,4/12/2017 10:00,16.132,https://monitoringpublic.solaredge.com/solaredge-web/p/site/public?name=TELUS%20Spark,27/11/2017,5941482017-12-04 10:00:00,2017-12-04 10:00:00,2017,12,4,9,30,-6.2,1.29,0.035,0.63,33,560,102,7,4,-14.6,46,1,7,46,0.288,51.38,82.87,0.94,0.14,895,0.6000000000000001,289,3.2,0.0,0.0,273.0
116,Telus Spark,594148,220 ST GEORGES DR NE,4/12/2017 11:00,13.507,https://monitoringpublic.solaredge.com/solaredge-web/p/site/public?name=TELUS%20Spark,27/11/2017,5941482017-12-04 11:00:00,2017-12-04 11:00:00,2017,12,4,10,30,-4.800000000000001,1.32,0.035,0.63,44,719,198,7,8,-13.9,96,18,7,100,0.286,49.05,77.65,0.94,0.14,895,0.6000000000000001,292,3.3000000000000003,4.7943,3.6665,273.0
117,Telus Spark,594148,220 ST GEORGES DR NE,4/12/2017 12:00,14.851,https://monitoringpublic.solaredge.com/solaredge-web/p/site/public?name=TELUS%20Spark,27/11/2017,5941482017-12-04 12:00:00,2017-12-04 12:00:00,2017,12,4,11,30,-3.5,1.36,0.03,0.63,48,796,263,0,1,-13.1,48,796,0,263,0.283,47.53,74.37,0.93,0.14,895,0.6000000000000001,292,3.2,12.9329,9.95,273.0
118,Telus Spark,594148,220 ST GEORGES DR NE,4/12/2017 13:00,13.62,https://monitoringpublic.solaredge.com/solaredge-web/p/site/public?name=TELUS%20Spark,27/11/2017,5941482017-12-04 13:00:00,2017-12-04 13:00:00,2017,12,4,12,30,-2.5,1.38,0.028,0.63,49,810,281,0,1,-12.2,49,810,0,281,0.282,47.14,73.34,0.93,0.14,894,0.7000000000000001,289,3.0,13.9493,10.7505,273.0
119,Telus Spark,594148,220 ST GEORGES DR NE,4/12/2017 14:00,11.915,https://monitoringpublic.solaredge.com/solaredge-web/p/site/public?name=TELUS%20Spark,27/11/2017,5941482017-12-04 14:00:00,2017-12-04 14:00:00,2017,12,4,13,30,-2.0,1.38,0.029,0.63,47,786,255,7,4,-11.4,155,88,7,178,0.282,48.47,74.66,0.93,0.14,894,0.7000000000000001,285,2.7,8.7304,6.7133,273.0
120,Telus Spark,594148,220 ST GEORGES DR NE,4/12/2017 15:00,4.244,https://monitoringpublic.solaredge.com/solaredge-web/p/site/public?name=TELUS%20Spark,27/11/2017,5941482017-12-04 15:00:00,2017-12-04 15:00:00,2017,12,4,14,30,-2.2,1.38,0.033,0.63,43,704,187,0,1,-10.7,43,704,0,187,0.285,52.11,78.19,0.94,0.14,894,0.7000000000000001,282,2.5,8.9414,6.8316,273.0
121,Telus Spark,594148,220 ST GEORGES DR NE,4/12/2017 16:00,0.28,https://monitoringpublic.solaredge.com/solaredge-web/p/site/public?name=TELUS%20Spark,27/11/2017,5941482017-12-04 16:00:00,2017-12-04 16:00:00,2017,12,4,15,30,-3.0,1.37,0.037,0.63,31,520,88,7,4,-10.3,27,0,7,27,0.288,57.27,83.61,0.94,0.14,894,0.7000000000000001,283,2.6,0.0,0.0,273.0
122,Telus Spark,594148,220 ST GEORGES DR NE,19/12/2017 11:00,4.642,https://monitoringpublic.solaredge.com/solaredge-web/p/site/public?name=TELUS%20Spark,27/11/2017,5941482017-12-19 11:00:00,2017-12-19 11:00:00,2017,12,19,10,30,-7.0,1.29,0.039,0.63,46,668,171,4,8,-10.3,82,5,4,83,0.379,77.5,79.2,0.94,0.8,890,0.6000000000000001,75,2.6,3.957,3.0184,273.0
123,Telus Spark,594148,220 ST GEORGES DR NE,19/12/2017 12:00,1.977,https://monitoringpublic.solaredge.com/solaredge-web/p/site/public?name=TELUS%20Spark,27/11/2017,5941482017-12-19 12:00:00,2017-12-19 12:00:00,2017,12,19,11,30,-6.9,1.32,0.051,0.63,58,727,238,4,6,-9.6,65,0,4,65,0.38,80.95,75.71000000000001,0.95,0.8,890,0.6000000000000001,86,3.0,3.1594,2.4249,273.0
124,Telus Spark,594148,220 ST GEORGES DR NE,19/12/2017 13:00,1.206,https://monitoringpublic.solaredge.com/solaredge-web/p/site/public?name=TELUS%20Spark,27/11/2017,5941482017-12-19 13:00:00,2017-12-19 13:00:00,2017,12,19,12,30,-7.0,1.29,0.071,0.63,68,717,261,4,8,-9.7,85,1,4,85,0.381,81.23,74.42,0.96,0.8,889,0.6000000000000001,93,3.2,4.178,3.2141,273.0
125,Telus Spark,594148,220 ST GEORGES DR NE,19/12/2017 14:00,0.627,https://monitoringpublic.solaredge.com/solaredge-web/p/site/public?name=TELUS%20Spark,27/11/2017,5941482017-12-19 14:00:00,2017-12-19 14:00:00,2017,12,19,13,30,-7.300000000000001,1.27,0.078,0.63,67,683,239,4,6,-10.0,89,2,4,89,0.383,80.74,75.45,0.96,0.8,889,0.6000000000000001,96,3.3000000000000003,4.3353,3.329,273.0
126,Telus Spark,594148,220 ST GEORGES DR NE,19/12/2017 15:00,0.048,https://monitoringpublic.solaredge.com/solaredge-web/p/site/public?name=TELUS%20Spark,27/11/2017,5941482017-12-19 15:00:00,2017-12-19 15:00:00,2017,12,19,14,30,-7.6,1.25,0.079,0.63,57,600,175,4,6,-10.5,73,2,4,73,0.384,79.65,78.7,0.96,0.8,888,0.6000000000000001,96,3.3000000000000003,3.484,2.6596,273.0
127,Telus Spark,594148,220 ST GEORGES DR NE,23/12/2017 11:00,0.015,https://monitoringpublic.solaredge.com/solaredge-web/p/site/public?name=TELUS%20Spark,27/11/2017,5941482017-12-23 11:00:00,2017-12-23 11:00:00,2017,12,23,10,30,-10.2,1.11,0.022,0.63,41,733,177,4,8,-15.4,68,2,4,69,0.409,65.85,79.34,0.94,0.8,895,0.3,292,3.7,3.289,2.5084,273.0
128,Telus Spark,594148,220 ST GEORGES DR NE,26/12/2017 11:00,0.009,https://monitoringpublic.solaredge.com/solaredge-web/p/site/public?name=TELUS%20Spark,27/11/2017,5941482017-12-26 11:00:00,2017-12-26 11:00:00,2017,12,26,10,30,-23.6,1.31,0.016,0.63,38,792,184,7,8,-29.9,84,3,7,85,0.394,56.39,79.37,0.9,0.8,896,0.1,201,1.4,4.0516,3.0899,273.0
129,Telus Spark,594148,220 ST GEORGES DR NE,31/12/2017 12:00,0.071,https://monitoringpublic.solaredge.com/solaredge-web/p/site/public?name=TELUS%20Spark,27/11/2017,5941482017-12-31 12:00:00,2017-12-31 12:00:00,2017,12,31,11,30,-22.8,1.17,0.016,0.63,46,871,263,0,0,-27.9,46,871,0,263,0.385,63.3,75.58,0.89,0.8,901,0.1,147,2.3000000000000003,12.7972,9.8243,273.0
130,Telus Spark,594148,220 ST GEORGES DR NE,5/12/2017 8:00,0.414,https://monitoringpublic.solaredge.com/solaredge-web/p/site/public?name=TELUS%20Spark,27/11/2017,5941482017-12-05 08:00:00,2017-12-05 08:00:00,2017,12,5,7,30,-4.4,1.51,0.015,0.63,0,0,0,0,1,-9.7,0,0,0,0,0.298,66.56,97.97,0.89,0.14,897,0.4,300,3.1,0.0,0.0,273.0
131,Telus Spark,594148,220 ST GEORGES DR NE,5/12/2017 9:00,2.825,https://monitoringpublic.solaredge.com/solaredge-web/p/site/public?name=TELUS%20Spark,27/11/2017,5941482017-12-05 09:00:00,2017-12-05 09:00:00,2017,12,5,8,30,-4.0,1.53,0.016,0.63,0,0,0,0,1,-9.8,0,0,0,0,0.297,64.03,89.52,0.89,0.14,898,0.4,298,3.3000000000000003,0.0,0.0,273.0
132,Telus Spark,594148,220 ST GEORGES DR NE,5/12/2017 10:00,4.608,https://monitoringpublic.solaredge.com/solaredge-web/p/site/public?name=TELUS%20Spark,27/11/2017,5941482017-12-05 10:00:00,2017-12-05 10:00:00,2017,12,5,9,30,-2.5,1.57,0.019,0.63,28,622,104,0,1,-9.7,28,622,0,104,0.297,57.92,83.02,0.89,0.14,898,0.4,296,3.7,0.0,0.0,273.0
133,Telus Spark,594148,220 ST GEORGES DR NE,5/12/2017 11:00,5.658,https://monitoringpublic.solaredge.com/solaredge-web/p/site/public?name=TELUS%20Spark,27/11/2017,5941482017-12-05 11:00:00,2017-12-05 11:00:00,2017,12,5,10,30,-0.5,1.63,0.023,0.63,40,776,204,0,1,-9.2,40,776,0,204,0.296,51.77,77.8,0.88,0.14,899,0.3,293,4.0,9.7725,7.4717,273.0
134,Telus Spark,594148,220 ST GEORGES DR NE,5/12/2017 12:00,8.383,https://monitoringpublic.solaredge.com/solaredge-web/p/site/public?name=TELUS%20Spark,27/11/2017,5941482017-12-05 12:00:00,2017-12-05 12:00:00,2017,12,5,11,30,1.3,1.65,0.027,0.63,46,832,268,0,1,-8.700000000000001,46,832,0,268,0.296,47.47,74.51,0.88,0.14,900,0.3,292,3.9,13.1622,10.1239,273.0
135,Telus Spark,594148,220 ST GEORGES DR NE,5/12/2017 13:00,6.316,https://monitoringpublic.solaredge.com/solaredge-web/p/site/public?name=TELUS%20Spark,27/11/2017,5941482017-12-05 13:00:00,2017-12-05 13:00:00,2017,12,5,12,30,2.6,1.64,0.027,0.63,48,849,289,0,1,-8.4,48,849,0,289,0.297,44.28,73.46000000000001,0.88,0.14,900,0.3,301,4.0,14.3304,11.0421,273.0
136,Telus Spark,594148,220 ST GEORGES DR NE,5/12/2017 14:00,4.131,https://monitoringpublic.solaredge.com/solaredge-web/p/site/public?name=TELUS%20Spark,27/11/2017,5941482017-12-05 14:00:00,2017-12-05 14:00:00,2017,12,5,13,30,3.0,1.65,0.028,0.63,46,825,263,0,0,-9.0,46,825,0,263,0.298,41.11,74.76,0.89,0.14,901,0.3,316,4.1000000000000005,12.8879,9.9086,273.0
137,Telus Spark,594148,220 ST GEORGES DR NE,5/12/2017 15:00,2.547,https://monitoringpublic.solaredge.com/solaredge-web/p/site/public?name=TELUS%20Spark,27/11/2017,5941482017-12-05 15:00:00,2017-12-05 15:00:00,2017,12,5,14,30,2.1,1.68,0.032,0.63,42,745,193,0,0,-9.6,42,745,0,193,0.3,41.61,78.28,0.89,0.14,902,0.3,324,3.8,9.2248,7.047,273.0
138,Telus Spark,594148,220 ST GEORGES DR NE,5/12/2017 16:00,0.339,https://monitoringpublic.solaredge.com/solaredge-web/p/site/public?name=TELUS%20Spark,27/11/2017,5941482017-12-05 16:00:00,2017-12-05 16:00:00,2017,12,5,15,30,0.4,1.7,0.034,0.63,29,570,92,0,0,-9.7,29,570,0,92,0.303,46.8,83.68,0.89,0.14,902,0.3,324,3.3000000000000003,0.0,0.0,273.0
139,Telus Spark,594148,220 ST GEORGES DR NE,6/12/2017 8:00,0.561,https://monitoringpublic.solaredge.com/solaredge-web/p/site/public?name=TELUS%20Spark,27/11/2017,5941482017-12-06 08:00:00,2017-12-06 08:00:00,2017,12,6,7,30,-5.4,1.47,0.019,0.63,0,0,0,0,1,-13.5,0,0,0,0,0.296,52.84,98.12,0.89,0.14,909,0.4,295,2.2,0.0,0.0,273.0
140,Telus Spark,594148,220 ST GEORGES DR NE,6/12/2017 9:00,4.828,https://monitoringpublic.solaredge.com/solaredge-web/p/site/public?name=TELUS%20Spark,27/11/2017,5941482017-12-06 09:00:00,2017-12-06 09:00:00,2017,12,6,8,30,-4.800000000000001,1.49,0.019,0.63,0,0,0,0,1,-13.6,0,0,0,0,0.294,50.22,89.64,0.89,0.14,909,0.5,290,2.3000000000000003,0.0,0.0,273.0
141,Telus Spark,594148,220 ST GEORGES DR NE,6/12/2017 10:00,10.574,https://monitoringpublic.solaredge.com/solaredge-web/p/site/public?name=TELUS%20Spark,27/11/2017,5941482017-12-06 10:00:00,2017-12-06 10:00:00,2017,12,6,9,30,-3.1,1.49,0.02,0.63,28,590,98,7,4,-13.0,55,2,7,56,0.293,46.29,83.17,0.9,0.14,909,0.6000000000000001,281,2.6,0.0,0.0,273.0
142,Telus Spark,594148,220 ST GEORGES DR NE,6/12/2017 11:00,14.85,https://monitoringpublic.solaredge.com/solaredge-web/p/site/public?name=TELUS%20Spark,27/11/2017,5941482017-12-06 11:00:00,2017-12-06 11:00:00,2017,12,6,10,30,-0.9,1.48,0.021,0.63,39,734,192,7,4,-12.0,100,5,7,101,0.292,42.76,77.95,0.9,0.14,909,0.7000000000000001,273,2.9000000000000004,4.8347,3.6954,273.0
143,Telus Spark,594148,220 ST GEORGES DR NE,6/12/2017 12:00,9.157,https://monitoringpublic.solaredge.com/solaredge-web/p/site/public?name=TELUS%20Spark,27/11/2017,5941482017-12-06 12:00:00,2017-12-06 12:00:00,2017,12,6,11,30,1.1,1.45,0.02,0.63,43,801,256,7,8,-11.0,127,254,7,195,0.291,40.14,74.64,0.91,0.14,909,0.7000000000000001,268,2.9000000000000004,9.5659,7.3561,273.0
144,Telus Spark,594148,220 ST GEORGES DR NE,6/12/2017 13:00,12.968,https://monitoringpublic.solaredge.com/solaredge-web/p/site/public?name=TELUS%20Spark,27/11/2017,5941482017-12-06 13:00:00,2017-12-06 13:00:00,2017,12,6,12,30,2.6,1.4,0.02,0.63,45,813,274,7,8,-9.5,93,576,7,256,0.29,40.51,73.58,0.91,0.14,908,0.8,263,2.6,12.68,9.7685,273.0
145,Telus Spark,594148,220 ST GEORGES DR NE,6/12/2017 14:00,10.826,https://monitoringpublic.solaredge.com/solaredge-web/p/site/public?name=TELUS%20Spark,27/11/2017,5941482017-12-06 14:00:00,2017-12-06 14:00:00,2017,12,6,13,30,3.2,1.36,0.02,0.63,43,791,250,7,8,-7.6,128,203,7,181,0.288,44.86,74.86,0.92,0.14,907,0.8,263,2.0,8.8618,6.812,273.0
146,Telus Spark,594148,220 ST GEORGES DR NE,6/12/2017 15:00,4.7,https://monitoringpublic.solaredge.com/solaredge-web/p/site/public?name=TELUS%20Spark,27/11/2017,5941482017-12-06 15:00:00,2017-12-06 15:00:00,2017,12,6,14,30,2.4000000000000004,1.35,0.022,0.63,39,709,182,7,8,-5.5,102,137,7,130,0.289,55.92,78.36,0.92,0.14,907,0.9,269,1.6,6.2116,4.7445,273.0
147,Telus Spark,594148,220 ST GEORGES DR NE,6/12/2017 16:00,0.472,https://monitoringpublic.solaredge.com/solaredge-web/p/site/public?name=TELUS%20Spark,27/11/2017,5941482017-12-06 16:00:00,2017-12-06 16:00:00,2017,12,6,15,30,0.6000000000000001,1.31,0.025,0.63,28,531,86,0,1,-5.1000000000000005,28,531,0,86,0.291,65.56,83.74,0.93,0.14,907,0.9,278,1.7000000000000002,0.0,0.0,273.0
148,Telus Spark,594148,220 ST GEORGES DR NE,7/12/2017 8:00,0.463,https://monitoringpublic.solaredge.com/solaredge-web/p/site/public?name=TELUS%20Spark,27/11/2017,5941482017-12-07 08:00:00,2017-12-07 08:00:00,2017,12,7,7,30,-1.5,1.27,0.022,0.63,0,0,0,0,8,-8.3,0,0,0,0,0.289,60.01,98.27,0.92,0.14,904,0.5,279,2.8000000000000003,0.0,0.0,273.0
149,Telus Spark,594148,220 ST GEORGES DR NE,7/12/2017 9:00,4.728,https://monitoringpublic.solaredge.com/solaredge-web/p/site/public?name=TELUS%20Spark,27/11/2017,5941482017-12-07 09:00:00,2017-12-07 09:00:00,2017,12,7,8,30,-0.8,1.28,0.023,0.63,0,0,0,0,1,-8.1,0,0,0,0,0.287,57.59,89.78,0.92,0.14,904,0.4,278,3.0,0.0,0.0,273.0
150,Telus Spark,594148,220 ST GEORGES DR NE,7/12/2017 10:00,8.907,https://monitoringpublic.solaredge.com/solaredge-web/p/site/public?name=TELUS%20Spark,27/11/2017,5941482017-12-07 10:00:00,2017-12-07 10:00:00,2017,12,7,9,30,0.8,1.32,0.022,0.63,29,599,99,1,4,-7.7,59,5,1,60,0.286,52.84,83.31,0.91,0.14,904,0.4,277,3.3000000000000003,0.0,0.0,273.0
151,Telus Spark,594148,220 ST GEORGES DR NE,7/12/2017 11:00,6.775,https://monitoringpublic.solaredge.com/solaredge-web/p/site/public?name=TELUS%20Spark,27/11/2017,5941482017-12-07 11:00:00,2017-12-07 11:00:00,2017,12,7,10,30,3.0,1.38,0.019,0.63,38,764,196,7,8,-7.0,98,277,7,156,0.285,47.72,78.08,0.89,0.14,904,0.4,277,3.5,7.4628,5.7029,273.0
152,Telus Spark,594148,220 ST GEORGES DR NE,7/12/2017 12:00,10.633,https://monitoringpublic.solaredge.com/solaredge-web/p/site/public?name=TELUS%20Spark,27/11/2017,5941482017-12-07 12:00:00,2017-12-07 12:00:00,2017,12,7,11,30,4.9,1.4,0.017,0.63,42,847,264,0,0,-6.0,42,847,0,264,0.284,45.18,74.77,0.88,0.14,903,0.3,277,3.4000000000000004,12.9357,9.9452,273.0
153,Telus Spark,594148,220 ST GEORGES DR NE,7/12/2017 13:00,6.319,https://monitoringpublic.solaredge.com/solaredge-web/p/site/public?name=TELUS%20Spark,27/11/2017,5941482017-12-07 13:00:00,2017-12-07 13:00:00,2017,12,7,12,30,5.9,1.4,0.016,0.63,42,867,286,7,7,-4.7,92,663,7,279,0.283,46.55,73.69,0.88,0.14,903,0.3,279,2.9000000000000004,13.8052,10.6334,273.0
154,Telus Spark,594148,220 ST GEORGES DR NE,7/12/2017 14:00,3.749,https://monitoringpublic.solaredge.com/solaredge-web/p/site/public?name=TELUS%20Spark,27/11/2017,5941482017-12-07 14:00:00,2017-12-07 14:00:00,2017,12,7,13,30,5.800000000000001,1.38,0.015,0.63,40,835,257,1,7,-3.4000000000000004,87,624,1,249,0.281,51.74,74.95,0.88,0.14,903,0.4,281,2.4000000000000004,12.1814,9.3623,273.0
155,Telus Spark,594148,220 ST GEORGES DR NE,7/12/2017 15:00,5.381,https://monitoringpublic.solaredge.com/solaredge-web/p/site/public?name=TELUS%20Spark,27/11/2017,5941482017-12-07 15:00:00,2017-12-07 15:00:00,2017,12,7,14,30,4.4,1.34,0.013,0.63,34,771,189,0,0,-2.6,34,771,0,189,0.278,60.45,78.43,0.88,0.14,903,0.4,281,2.1,9.0283,6.8951,273.0
156,Telus Spark,594148,220 ST GEORGES DR NE,7/12/2017 16:00,1.175,https://monitoringpublic.solaredge.com/solaredge-web/p/site/public?name=TELUS%20Spark,27/11/2017,5941482017-12-07 16:00:00,2017-12-07 16:00:00,2017,12,7,15,30,2.4000000000000004,1.32,0.012,0.63,24,612,90,7,8,-3.0,57,121,7,70,0.276,67.76,83.79,0.88,0.14,903,0.4,279,2.2,0.0,0.0,273.0
157,Telus Spark,594148,220 ST GEORGES DR NE,8/12/2017 8:00,0.35,https://monitoringpublic.solaredge.com/solaredge-web/p/site/public?name=TELUS%20Spark,27/11/2017,5941482017-12-08 08:00:00,2017-12-08 08:00:00,2017,12,8,7,30,-1.3,1.32,0.01,0.63,0,0,0,0,1,-10.5,0,0,0,0,0.299,49.57,98.42,0.86,0.14,900,0.2,280,3.0,0.0,0.0,273.0
158,Telus Spark,594148,220 ST GEORGES DR NE,8/12/2017 9:00,2.769,https://monitoringpublic.solaredge.com/solaredge-web/p/site/public?name=TELUS%20Spark,27/11/2017,5941482017-12-08 09:00:00,2017-12-08 09:00:00,2017,12,8,8,30,-0.9,1.33,0.01,0.63,0,0,0,7,4,-10.7,0,0,7,0,0.301,47.47,89.9,0.85,0.14,900,0.2,282,3.1,0.0,0.0,273.0
159,Telus Spark,594148,220 ST GEORGES DR NE,8/12/2017 10:00,4.248,https://monitoringpublic.solaredge.com/solaredge-web/p/site/public?name=TELUS%20Spark,27/11/2017,5941482017-12-08 10:00:00,2017-12-08 10:00:00,2017,12,8,9,30,0.5,1.34,0.01,0.63,24,664,99,7,4,-10.3,63,22,7,66,0.3,44.31,83.45,0.85,0.14,900,0.2,282,3.3000000000000003,0.0,0.0,273.0
160,Telus Spark,594148,220 ST GEORGES DR NE,8/12/2017 11:00,4.738,https://monitoringpublic.solaredge.com/solaredge-web/p/site/public?name=TELUS%20Spark,27/11/2017,5941482017-12-08 11:00:00,2017-12-08 11:00:00,2017,12,8,10,30,2.5,1.34,0.01,0.63,32,814,198,0,1,-9.5,32,814,0,198,0.299,40.91,78.21000000000001,0.85,0.14,900,0.2,283,3.5,9.4666,7.2325,273.0
161,Telus Spark,594148,220 ST GEORGES DR NE,8/12/2017 12:00,6.114,https://monitoringpublic.solaredge.com/solaredge-web/p/site/public?name=TELUS%20Spark,27/11/2017,5941482017-12-08 12:00:00,2017-12-08 12:00:00,2017,12,8,11,30,4.2,1.34,0.01,0.63,35,877,264,0,1,-8.6,35,877,0,264,0.297,38.89,74.89,0.85,0.14,900,0.2,283,3.4000000000000004,12.9221,9.9326,273.0
162,Telus Spark,594148,220 ST GEORGES DR NE,8/12/2017 13:00,5.542,https://monitoringpublic.solaredge.com/solaredge-web/p/site/public?name=TELUS%20Spark,27/11/2017,5941482017-12-08 13:00:00,2017-12-08 13:00:00,2017,12,8,12,30,5.300000000000001,1.32,0.01,0.63,37,894,286,0,0,-7.5,37,894,0,286,0.295,39.09,73.79,0.86,0.14,899,0.2,283,3.2,14.1385,10.8883,273.0
163,Telus Spark,594148,220 ST GEORGES DR NE,8/12/2017 14:00,4.139,https://monitoringpublic.solaredge.com/solaredge-web/p/site/public?name=TELUS%20Spark,27/11/2017,5941482017-12-08 14:00:00,2017-12-08 14:00:00,2017,12,8,13,30,5.300000000000001,1.31,0.01,0.63,35,875,261,0,0,-6.800000000000001,35,875,0,261,0.294,41.34,75.04,0.86,0.14,899,0.2,282,2.8000000000000003,12.7585,9.8042,273.0
164,Telus Spark,594148,220 ST GEORGES DR NE,8/12/2017 15:00,2.467,https://monitoringpublic.solaredge.com/solaredge-web/p/site/public?name=TELUS%20Spark,27/11/2017,5941482017-12-08 15:00:00,2017-12-08 15:00:00,2017,12,8,14,30,4.1000000000000005,1.42,0.013,0.63,34,801,194,0,0,-6.1000000000000005,34,801,0,194,0.294,47.48,78.49,0.86,0.14,899,0.2,281,2.5,9.2651,7.0753,273.0
165,Telus Spark,594148,220 ST GEORGES DR NE,8/12/2017 16:00,0.236,https://monitoringpublic.solaredge.com/solaredge-web/p/site/public?name=TELUS%20Spark,27/11/2017,5941482017-12-08 16:00:00,2017-12-08 16:00:00,2017,12,8,15,30,2.4000000000000004,1.4,0.013,0.63,25,640,93,0,0,-6.7,25,640,0,93,0.295,51.14,83.83,0.86,0.14,899,0.2,281,2.6,0.0,0.0,273.0
166,Telus Spark,594148,220 ST GEORGES DR NE,9/12/2017 8:00,0.394,https://monitoringpublic.solaredge.com/solaredge-web/p/site/public?name=TELUS%20Spark,27/11/2017,5941482017-12-09 08:00:00,2017-12-09 08:00:00,2017,12,9,7,30,-0.1,1.17,0.018,0.63,0,0,0,0,1,-11.2,0,0,0,0,0.324,42.86,98.56,0.9,0.14,898,0.4,276,3.3000000000000003,0.0,0.0,273.0
167,Telus Spark,594148,220 ST GEORGES DR NE,9/12/2017 9:00,2.848,https://monitoringpublic.solaredge.com/solaredge-web/p/site/public?name=TELUS%20Spark,27/11/2017,5941482017-12-09 09:00:00,2017-12-09 09:00:00,2017,12,9,8,30,0.0,1.2,0.017,0.63,0,0,0,0,1,-11.4,0,0,0,0,0.326,41.86,90.02,0.89,0.14,898,0.4,280,3.4000000000000004,0.0,0.0,273.0
168,Telus Spark,594148,220 ST GEORGES DR NE,9/12/2017 10:00,4.563,https://monitoringpublic.solaredge.com/solaredge-web/p/site/public?name=TELUS%20Spark,27/11/2017,5941482017-12-09 10:00:00,2017-12-09 10:00:00,2017,12,9,9,30,1.3,1.23,0.016,0.63,26,604,94,0,1,-11.2,26,604,0,94,0.329,38.74,83.58,0.89,0.14,899,0.4,281,3.6,0.0,0.0,273.0
169,Telus Spark,594148,220 ST GEORGES DR NE,9/12/2017 11:00,5.174,https://monitoringpublic.solaredge.com/solaredge-web/p/site/public?name=TELUS%20Spark,27/11/2017,5941482017-12-09 11:00:00,2017-12-09 11:00:00,2017,12,9,10,30,3.3000000000000003,1.25,0.016,0.63,36,763,190,0,0,-10.7,36,763,0,190,0.331,35.07,78.34,0.88,0.14,899,0.4,277,3.8,9.0792,6.9351,273.0
170,Telus Spark,594148,220 ST GEORGES DR NE,9/12/2017 12:00,5.423,https://monitoringpublic.solaredge.com/solaredge-web/p/site/public?name=TELUS%20Spark,27/11/2017,5941482017-12-09 12:00:00,2017-12-09 12:00:00,2017,12,9,11,30,5.1000000000000005,1.26,0.015,0.63,40,832,255,0,0,-9.7,40,832,0,255,0.331,33.43,75.0,0.88,0.14,899,0.4,273,3.6,12.4695,9.5828,273.0
171,Telus Spark,594148,220 ST GEORGES DR NE,9/12/2017 13:00,5.347,https://monitoringpublic.solaredge.com/solaredge-web/p/site/public?name=TELUS%20Spark,27/11/2017,5941482017-12-09 13:00:00,2017-12-09 13:00:00,2017,12,9,12,30,6.1000000000000005,1.26,0.016,0.63,42,848,277,0,0,-8.1,42,848,0,277,0.331,35.31,73.89,0.88,0.14,898,0.4,271,3.3000000000000003,13.681,10.5342,273.0
172,Telus Spark,594148,220 ST GEORGES DR NE,9/12/2017 14:00,5.666,https://monitoringpublic.solaredge.com/solaredge-web/p/site/public?name=TELUS%20Spark,27/11/2017,5941482017-12-09 14:00:00,2017-12-09 14:00:00,2017,12,9,13,30,6.1000000000000005,1.26,0.016,0.63,40,828,253,0,0,-6.7,40,828,0,253,0.333,39.56,75.11,0.88,0.14,898,0.4,271,2.9000000000000004,12.3599,9.4967,273.0
173,Telus Spark,594148,220 ST GEORGES DR NE,9/12/2017 15:00,4.743,https://monitoringpublic.solaredge.com/solaredge-web/p/site/public?name=TELUS%20Spark,27/11/2017,5941482017-12-09 15:00:00,2017-12-09 15:00:00,2017,12,9,14,30,4.9,1.23,0.015,0.63,35,760,186,0,1,-5.9,35,760,0,186,0.337,45.7,78.55,0.88,0.14,898,0.4,271,2.7,8.8812,6.7815,273.0
174,Telus Spark,594148,220 ST GEORGES DR NE,9/12/2017 16:00,0.938,https://monitoringpublic.solaredge.com/solaredge-web/p/site/public?name=TELUS%20Spark,27/11/2017,5941482017-12-09 16:00:00,2017-12-09 16:00:00,2017,12,9,15,30,2.9000000000000004,1.23,0.015,0.63,25,595,89,7,8,-6.1000000000000005,54,21,7,56,0.34,51.64,83.87,0.89,0.14,898,0.4,272,2.6,0.0,0.0,273.0
175,Telus Spark,594148,220 ST GEORGES DR NE,10/12/2017 8:00,0.068,https://monitoringpublic.solaredge.com/solaredge-web/p/site/public?name=TELUS%20Spark,27/11/2017,5941482017-12-10 08:00:00,2017-12-10 08:00:00,2017,12,10,7,30,1.7000000000000002,1.65,0.1,0.63,0,0,0,1,6,-9.9,0,0,1,0,0.354,41.96,98.69,0.91,0.14,898,1.0,287,2.6,0.0,0.0,273.0
176,Telus Spark,594148,220 ST GEORGES DR NE,10/12/2017 9:00,3.051,https://monitoringpublic.solaredge.com/solaredge-web/p/site/public?name=TELUS%20Spark,27/11/2017,5941482017-12-10 09:00:00,2017-12-10 09:00:00,2017,12,10,8,30,1.1,1.7,0.069,0.63,0,0,0,0,1,-9.2,0,0,0,0,0.359,46.02,90.14,0.9,0.14,898,0.8,285,2.4000000000000004,0.0,0.0,273.0
177,Telus Spark,594148,220 ST GEORGES DR NE,10/12/2017 10:00,5.007,https://monitoringpublic.solaredge.com/solaredge-web/p/site/public?name=TELUS%20Spark,27/11/2017,5941482017-12-10 10:00:00,2017-12-10 10:00:00,2017,12,10,9,30,2.0,1.65,0.051,0.63,30,493,85,0,1,-9.9,30,493,0,85,0.359,40.85,83.7,0.89,0.14,899,0.6000000000000001,281,3.3000000000000003,0.0,0.0,273.0
178,Telus Spark,594148,220 ST GEORGES DR NE,10/12/2017 11:00,6.04,https://monitoringpublic.solaredge.com/solaredge-web/p/site/public?name=TELUS%20Spark,27/11/2017,5941482017-12-10 11:00:00,2017-12-10 11:00:00,2017,12,10,10,30,4.2,1.57,0.033,0.63,41,712,183,0,1,-10.7,41,712,0,183,0.357,32.99,78.45,0.89,0.14,899,0.5,288,4.3,8.741,6.6755,273.0
179,Telus Spark,594148,220 ST GEORGES DR NE,10/12/2017 12:00,7.283,https://monitoringpublic.solaredge.com/solaredge-web/p/site/public?name=TELUS%20Spark,27/11/2017,5941482017-12-10 12:00:00,2017-12-10 12:00:00,2017,12,10,11,30,5.800000000000001,1.46,0.024,0.63,44,811,253,1,0,-9.9,44,811,1,253,0.354,31.38,75.10000000000001,0.9,0.14,899,0.4,297,4.2,12.361,9.4977,273.0
180,Telus Spark,594148,220 ST GEORGES DR NE,10/12/2017 13:00,5.94,https://monitoringpublic.solaredge.com/solaredge-web/p/site/public?name=TELUS%20Spark,27/11/2017,5941482017-12-10 13:00:00,2017-12-10 13:00:00,2017,12,10,12,30,5.9,1.43,0.022,0.63,45,834,275,0,0,-8.3,45,834,0,275,0.351,35.27,73.97,0.9,0.14,899,0.4,296,3.4000000000000004,13.5723,10.4491,273.0
181,Telus Spark,594148,220 ST GEORGES DR NE,10/12/2017 14:00,4.513,https://monitoringpublic.solaredge.com/solaredge-web/p/site/public?name=TELUS%20Spark,27/11/2017,5941482017-12-10 14:00:00,2017-12-10 14:00:00,2017,12,10,13,30,5.4,1.43,0.022,0.63,43,813,251,1,0,-7.1000000000000005,43,813,1,251,0.35,40.22,75.18,0.9,0.14,900,0.4,294,2.8000000000000003,12.2548,9.4148,273.0
182,Telus Spark,594148,220 ST GEORGES DR NE,10/12/2017 15:00,3.077,https://monitoringpublic.solaredge.com/solaredge-web/p/site/public?name=TELUS%20Spark,27/11/2017,5941482017-12-10 15:00:00,2017-12-10 15:00:00,2017,12,10,14,30,4.1000000000000005,1.45,0.026,0.63,39,733,184,0,0,-6.4,39,733,0,184,0.349,46.42,78.60000000000001,0.9,0.14,900,0.4,292,2.5,8.7843,6.7069,273.0
183,Telus Spark,594148,220 ST GEORGES DR NE,10/12/2017 16:00,0.404,https://monitoringpublic.solaredge.com/solaredge-web/p/site/public?name=TELUS%20Spark,27/11/2017,5941482017-12-10 16:00:00,2017-12-10 16:00:00,2017,12,10,15,30,2.6,1.43,0.027,0.63,28,560,87,0,1,-6.1000000000000005,28,560,0,87,0.347,52.83,83.9,0.9,0.14,900,0.4,293,2.3000000000000003,0.0,0.0,273.0
184,Telus Spark,594148,220 ST GEORGES DR NE,11/12/2017 8:00,0.14,https://monitoringpublic.solaredge.com/solaredge-web/p/site/public?name=TELUS%20Spark,27/11/2017,5941482017-12-11 08:00:00,2017-12-11 08:00:00,2017,12,11,7,30,-2.2,1.41,0.024,0.63,0,0,0,0,8,-8.700000000000001,0,0,0,0,0.353,60.83,98.82,0.91,0.14,903,0.8,283,1.7000000000000002,0.0,0.0,273.0
185,Telus Spark,594148,220 ST GEORGES DR NE,11/12/2017 9:00,3.641,https://monitoringpublic.solaredge.com/solaredge-web/p/site/public?name=TELUS%20Spark,27/11/2017,5941482017-12-11 09:00:00,2017-12-11 09:00:00,2017,12,11,8,30,-1.5,1.4,0.025,0.63,0,0,0,0,1,-9.0,0,0,0,0,0.354,56.43,90.23,0.91,0.14,903,0.8,280,1.7000000000000002,0.0,0.0,273.0
186,Telus Spark,594148,220 ST GEORGES DR NE,11/12/2017 10:00,7.266,https://monitoringpublic.solaredge.com/solaredge-web/p/site/public?name=TELUS%20Spark,27/11/2017,5941482017-12-11 10:00:00,2017-12-11 10:00:00,2017,12,11,9,30,0.5,1.38,0.026,0.63,27,530,84,0,1,-8.700000000000001,27,530,0,84,0.353,49.94,83.82000000000001,0.91,0.14,903,0.8,277,1.8,0.0,0.0,273.0
187,Telus Spark,594148,220 ST GEORGES DR NE,11/12/2017 11:00,5.059,https://monitoringpublic.solaredge.com/solaredge-web/p/site/public?name=TELUS%20Spark,27/11/2017,5941482017-12-11 11:00:00,2017-12-11 11:00:00,2017,12,11,10,30,3.0,1.38,0.025,0.63,39,696,177,0,1,-7.7,39,696,0,177,0.353,45.32,78.56,0.91,0.14,902,0.9,273,1.8,8.4512,6.453,273.0
188,Telus Spark,594148,220 ST GEORGES DR NE,11/12/2017 12:00,4.994,https://monitoringpublic.solaredge.com/solaredge-web/p/site/public?name=TELUS%20Spark,27/11/2017,5941482017-12-11 12:00:00,2017-12-11 12:00:00,2017,12,11,11,30,5.0,1.36,0.021,0.63,42,775,241,0,1,-6.800000000000001,42,775,0,241,0.351,42.33,75.2,0.91,0.14,902,0.9,269,1.7000000000000002,11.7645,9.0378,273.0
189,Telus Spark,594148,220 ST GEORGES DR NE,11/12/2017 13:00,5.302,https://monitoringpublic.solaredge.com/solaredge-web/p/site/public?name=TELUS%20Spark,27/11/2017,5941482017-12-11 13:00:00,2017-12-11 13:00:00,2017,12,11,12,30,6.1000000000000005,1.36,0.021,0.63,44,791,261,0,0,-4.9,44,791,0,261,0.35,45.06,74.05,0.92,0.14,901,1.0,265,1.4,12.8719,9.9085,273.0
190,Telus Spark,594148,220 ST GEORGES DR NE,11/12/2017 14:00,4.813,https://monitoringpublic.solaredge.com/solaredge-web/p/site/public?name=TELUS%20Spark,27/11/2017,5941482017-12-11 14:00:00,2017-12-11 14:00:00,2017,12,11,13,30,5.9,1.35,0.022,0.63,43,764,237,1,0,-2.2,43,764,1,237,0.348,56.17,75.24,0.92,0.14,900,1.1,261,1.2000000000000002,11.5653,8.8841,273.0
191,Telus Spark,594148,220 ST GEORGES DR NE,11/12/2017 15:00,2.367,https://monitoringpublic.solaredge.com/solaredge-web/p/site/public?name=TELUS%20Spark,27/11/2017,5941482017-12-11 15:00:00,2017-12-11 15:00:00,2017,12,11,14,30,4.800000000000001,1.36,0.024,0.63,38,683,173,0,0,-1.3,38,683,0,173,0.348,64.75,78.64,0.93,0.14,900,1.2000000000000002,258,1.3,8.2581,6.3047,273.0
192,Telus Spark,594148,220 ST GEORGES DR NE,11/12/2017 16:00,0.225,https://monitoringpublic.solaredge.com/solaredge-web/p/site/public?name=TELUS%20Spark,27/11/2017,5941482017-12-11 16:00:00,2017-12-11 16:00:00,2017,12,11,15,30,3.2,1.35,0.024,0.63,27,512,81,0,0,-1.3,27,512,0,81,0.348,72.13,83.93,0.93,0.14,900,1.2000000000000002,258,1.5,0.0,0.0,273.0
193,Telus Spark,594148,220 ST GEORGES DR NE,12/12/2017 8:00,0.116,https://monitoringpublic.solaredge.com/solaredge-web/p/site/public?name=TELUS%20Spark,27/11/2017,5941482017-12-12 08:00:00,2017-12-12 08:00:00,2017,12,12,7,30,2.4000000000000004,1.37,0.03,0.63,0,0,0,0,6,-12.1,0,0,0,0,0.357,33.33,98.95,0.91,0.15,892,0.5,272,3.5,0.0,0.0,273.0
194,Telus Spark,594148,220 ST GEORGES DR NE,12/12/2017 9:00,2.693,https://monitoringpublic.solaredge.com/solaredge-web/p/site/public?name=TELUS%20Spark,27/11/2017,5941482017-12-12 09:00:00,2017-12-12 09:00:00,2017,12,12,8,30,3.0,1.43,0.035,0.63,0,0,0,0,6,-11.7,0,0,0,0,0.357,33.2,90.93,0.91,0.15,893,0.7000000000000001,274,3.6,0.0,0.0,273.0
195,Telus Spark,594148,220 ST GEORGES DR NE,12/12/2017 10:00,3.753,https://monitoringpublic.solaredge.com/solaredge-web/p/site/public?name=TELUS%20Spark,27/11/2017,5941482017-12-12 10:00:00,2017-12-12 10:00:00,2017,12,12,9,30,4.0,1.49,0.035,0.63,28,500,81,7,9,-11.4,16,0,7,16,0.355,31.62,83.93,0.91,0.15,893,0.9,274,3.8,0.0,0.0,273.0
196,Telus Spark,594148,220 ST GEORGES DR NE,12/12/2017 11:00,7.236,https://monitoringpublic.solaredge.com/solaredge-web/p/site/public?name=TELUS%20Spark,27/11/2017,5941482017-12-12 11:00:00,2017-12-12 11:00:00,2017,12,12,10,30,4.4,1.46,0.037,0.63,41,665,172,7,9,-10.6,6,0,7,6,0.353,32.83,78.67,0.92,0.15,894,1.0,277,3.5,0.2864,0.2186,273.0
197,Telus Spark,594148,220 ST GEORGES DR NE,12/12/2017 12:00,9.31,https://monitoringpublic.solaredge.com/solaredge-web/p/site/public?name=TELUS%20Spark,27/11/2017,5941482017-12-12 12:00:00,2017-12-12 12:00:00,2017,12,12,11,30,4.6000000000000005,1.39,0.038,0.63,48,732,234,7,9,-9.1,25,0,7,25,0.354,36.22,75.29,0.93,0.15,895,1.1,283,3.1,1.2194,0.9367,273.0
198,Telus Spark,594148,220 ST GEORGES DR NE,12/12/2017 13:00,10.402,https://monitoringpublic.solaredge.com/solaredge-web/p/site/public?name=TELUS%20Spark,27/11/2017,5941482017-12-12 13:00:00,2017-12-12 13:00:00,2017,12,12,12,30,5.2,1.4,0.032,0.63,48,774,260,7,6,-7.800000000000001,137,69,7,156,0.358,38.41,74.13,0.92,0.15,895,0.9,285,2.9000000000000004,7.688,5.9172,273.0
199,Telus Spark,594148,220 ST GEORGES DR NE,12/12/2017 14:00,4.366,https://monitoringpublic.solaredge.com/solaredge-web/p/site/public?name=TELUS%20Spark,27/11/2017,5941482017-12-12 14:00:00,2017-12-12 14:00:00,2017,12,12,13,30,5.9,1.46,0.028,0.63,45,773,241,7,8,-7.0,127,209,7,180,0.363,39.17,75.29,0.9,0.15,894,0.7000000000000001,287,3.2,8.78,6.7439,273.0
200,Telus Spark,594148,220 ST GEORGES DR NE,12/12/2017 15:00,2.753,https://monitoringpublic.solaredge.com/solaredge-web/p/site/public?name=TELUS%20Spark,27/11/2017,5941482017-12-12 15:00:00,2017-12-12 15:00:00,2017,12,12,14,30,5.1000000000000005,1.5,0.027,0.63,39,710,178,0,1,-6.4,39,710,0,178,0.366,43.16,78.67,0.9,0.15,895,0.6000000000000001,293,3.3000000000000003,8.4959,6.486,273.0
201,Telus Spark,594148,220 ST GEORGES DR NE,12/12/2017 16:00,0.275,https://monitoringpublic.solaredge.com/solaredge-web/p/site/public?name=TELUS%20Spark,27/11/2017,5941482017-12-12 16:00:00,2017-12-12 16:00:00,2017,12,12,15,30,3.1,1.54,0.027,0.63,27,539,84,0,0,-5.6000000000000005,27,539,0,84,0.367,52.99,83.94,0.89,0.15,895,0.6000000000000001,298,3.0,0.0,0.0,273.0
202,Telus Spark,594148,220 ST GEORGES DR NE,13/12/2017 8:00,0.397,https://monitoringpublic.solaredge.com/solaredge-web/p/site/public?name=TELUS%20Spark,27/11/2017,5941482017-12-13 08:00:00,2017-12-13 08:00:00,2017,12,13,7,30,-0.3,1.56,0.054,0.63,0,0,0,0,8,-5.300000000000001,0,0,0,0,0.375,69.23,99.06,0.93,0.15,898,0.9,287,2.0,0.0,0.0,273.0
203,Telus Spark,594148,220 ST GEORGES DR NE,13/12/2017 9:00,4.754,https://monitoringpublic.solaredge.com/solaredge-web/p/site/public?name=TELUS%20Spark,27/11/2017,5941482017-12-13 09:00:00,2017-12-13 09:00:00,2017,12,13,8,30,0.0,1.54,0.045,0.63,0,0,0,0,8,-5.2,0,0,0,0,0.379,67.85,91.04,0.93,0.15,899,0.9,290,2.3000000000000003,0.0,0.0,273.0
204,Telus Spark,594148,220 ST GEORGES DR NE,13/12/2017 10:00,11.204,https://monitoringpublic.solaredge.com/solaredge-web/p/site/public?name=TELUS%20Spark,27/11/2017,5941482017-12-13 10:00:00,2017-12-13 10:00:00,2017,12,13,9,30,1.1,1.53,0.033,0.63,27,498,79,7,8,-5.1000000000000005,48,9,7,49,0.383,63.34,84.04,0.92,0.15,899,0.9,294,2.7,0.0,0.0,273.0
205,Telus Spark,594148,220 ST GEORGES DR NE,13/12/2017 11:00,9.992,https://monitoringpublic.solaredge.com/solaredge-web/p/site/public?name=TELUS%20Spark,27/11/2017,5941482017-12-13 11:00:00,2017-12-13 11:00:00,2017,12,13,10,30,2.8000000000000003,1.53,0.026,0.63,38,689,172,7,8,-4.7,76,9,7,78,0.384,57.83,78.76,0.91,0.15,899,0.9,300,3.1,3.722,2.841,273.0
206,Telus Spark,594148,220 ST GEORGES DR NE,13/12/2017 12:00,11.266,https://monitoringpublic.solaredge.com/solaredge-web/p/site/public?name=TELUS%20Spark,27/11/2017,5941482017-12-13 12:00:00,2017-12-13 12:00:00,2017,12,13,11,30,4.3,1.5,0.023,0.63,43,768,237,7,4,-4.0,89,1,7,89,0.381,54.89,75.37,0.91,0.15,899,0.9,310,3.4000000000000004,4.3383,3.3317,273.0
207,Telus Spark,594148,220 ST GEORGES DR NE,13/12/2017 13:00,5.61,https://monitoringpublic.solaredge.com/solaredge-web/p/site/public?name=TELUS%20Spark,27/11/2017,5941482017-12-13 13:00:00,2017-12-13 13:00:00,2017,12,13,12,30,5.300000000000001,1.5,0.025,0.63,45,791,261,7,4,-3.0,157,97,7,184,0.376,54.9,74.19,0.91,0.15,900,0.8,320,3.6,9.0629,6.9747,273.0
208,Telus Spark,594148,220 ST GEORGES DR NE,13/12/2017 14:00,4.279,https://monitoringpublic.solaredge.com/solaredge-web/p/site/public?name=TELUS%20Spark,27/11/2017,5941482017-12-13 14:00:00,2017-12-13 14:00:00,2017,12,13,13,30,5.2,1.51,0.027,0.63,44,773,240,0,0,-2.3000000000000003,44,773,0,240,0.373,58.33,75.34,0.9,0.15,900,0.7000000000000001,326,3.3000000000000003,11.7016,8.9872,273.0
209,Telus Spark,594148,220 ST GEORGES DR NE,13/12/2017 15:00,2.577,https://monitoringpublic.solaredge.com/solaredge-web/p/site/public?name=TELUS%20Spark,27/11/2017,5941482017-12-13 15:00:00,2017-12-13 15:00:00,2017,12,13,14,30,3.8,1.48,0.024,0.63,38,715,178,0,0,-1.9,38,715,0,178,0.369,66.57000000000001,78.7,0.9,0.15,900,0.6000000000000001,329,2.6,8.4952,6.4851,273.0
210,Telus Spark,594148,220 ST GEORGES DR NE,13/12/2017 16:00,0.231,https://monitoringpublic.solaredge.com/solaredge-web/p/site/public?name=TELUS%20Spark,27/11/2017,5941482017-12-13 16:00:00,2017-12-13 16:00:00,2017,12,13,15,30,1.3,1.47,0.022,0.63,26,551,84,0,1,-1.9,26,551,0,84,0.366,79.44,83.95,0.9,0.15,900,0.6000000000000001,329,2.1,0.0,0.0,273.0
211,Telus Spark,594148,220 ST GEORGES DR NE,14/12/2017 8:00,0.201,https://monitoringpublic.solaredge.com/solaredge-web/p/site/public?name=TELUS%20Spark,27/11/2017,5941482017-12-14 08:00:00,2017-12-14 08:00:00,2017,12,14,7,30,-2.9000000000000004,1.29,0.016,0.63,0,0,0,0,4,-6.5,0,0,0,0,0.332,76.4,99.18,0.91,0.15,898,0.7000000000000001,249,1.7000000000000002,0.0,0.0,273.0
212,Telus Spark,594148,220 ST GEORGES DR NE,14/12/2017 9:00,2.835,https://monitoringpublic.solaredge.com/solaredge-web/p/site/public?name=TELUS%20Spark,27/11/2017,5941482017-12-14 09:00:00,2017-12-14 09:00:00,2017,12,14,8,30,-3.0,1.29,0.015,0.63,0,0,0,0,1,-6.7,0,0,0,0,0.327,75.9,91.15,0.91,0.15,897,0.7000000000000001,250,1.6,0.0,0.0,273.0
213,Telus Spark,594148,220 ST GEORGES DR NE,14/12/2017 10:00,5.048,https://monitoringpublic.solaredge.com/solaredge-web/p/site/public?name=TELUS%20Spark,27/11/2017,5941482017-12-14 10:00:00,2017-12-14 10:00:00,2017,12,14,9,30,-1.8,1.29,0.014,0.63,24,561,81,0,1,-6.6000000000000005,24,561,0,81,0.321,69.81,84.13,0.9,0.15,897,0.7000000000000001,252,1.9,0.0,0.0,273.0
214,Telus Spark,594148,220 ST GEORGES DR NE,14/12/2017 11:00,5.727,https://monitoringpublic.solaredge.com/solaredge-web/p/site/public?name=TELUS%20Spark,27/11/2017,5941482017-12-14 11:00:00,2017-12-14 11:00:00,2017,12,14,10,30,0.1,1.31,0.013,0.63,33,733,175,0,1,-6.300000000000001,33,733,0,175,0.317,62.13,78.85000000000001,0.9,0.15,896,0.7000000000000001,252,2.2,8.3486,6.3717,273.0
215,Telus Spark,594148,220 ST GEORGES DR NE,14/12/2017 12:00,12.676,https://monitoringpublic.solaredge.com/solaredge-web/p/site/public?name=TELUS%20Spark,27/11/2017,5941482017-12-14 12:00:00,2017-12-14 12:00:00,2017,12,14,11,30,1.9,1.45,0.016,0.63,40,798,240,0,1,-5.9,40,798,0,240,0.313,56.33,75.45,0.89,0.15,895,0.7000000000000001,250,2.2,11.6907,8.9771,273.0
216,Telus Spark,594148,220 ST GEORGES DR NE,14/12/2017 13:00,17.34,https://monitoringpublic.solaredge.com/solaredge-web/p/site/public?name=TELUS%20Spark,27/11/2017,5941482017-12-14 13:00:00,2017-12-14 13:00:00,2017,12,14,12,30,3.3000000000000003,1.43,0.016,0.63,41,813,262,7,8,-5.0,138,184,7,188,0.309,54.5,74.25,0.9,0.15,895,0.8,251,2.0,9.2549,7.1218,273.0
217,Telus Spark,594148,220 ST GEORGES DR NE,14/12/2017 14:00,9.926,https://monitoringpublic.solaredge.com/solaredge-web/p/site/public?name=TELUS%20Spark,27/11/2017,5941482017-12-14 14:00:00,2017-12-14 14:00:00,2017,12,14,13,30,3.6,1.37,0.019,0.63,42,787,240,7,8,-4.0,133,127,7,165,0.307,57.56,75.38,0.91,0.15,894,0.8,257,1.6,8.0421,6.1762,273.0
218,Telus Spark,594148,220 ST GEORGES DR NE,14/12/2017 15:00,4.219,https://monitoringpublic.solaredge.com/solaredge-web/p/site/public?name=TELUS%20Spark,27/11/2017,5941482017-12-14 15:00:00,2017-12-14 15:00:00,2017,12,14,14,30,2.8000000000000003,1.41,0.026,0.63,39,695,175,7,8,-2.7,98,32,7,105,0.307,66.97,78.72,0.92,0.15,893,0.9,265,1.4,5.0109,3.8251,273.0
219,Telus Spark,594148,220 ST GEORGES DR NE,14/12/2017 16:00,0.239,https://monitoringpublic.solaredge.com/solaredge-web/p/site/public?name=TELUS%20Spark,27/11/2017,5941482017-12-14 16:00:00,2017-12-14 16:00:00,2017,12,14,15,30,1.6,1.41,0.027,0.63,27,521,82,0,1,-3.3000000000000003,27,521,0,82,0.309,69.99,83.95,0.92,0.15,892,0.9,273,1.8,0.0,0.0,273.0
220,Telus Spark,594148,220 ST GEORGES DR NE,15/12/2017 8:00,0.019,https://monitoringpublic.solaredge.com/solaredge-web/p/site/public?name=TELUS%20Spark,27/11/2017,5941482017-12-15 08:00:00,2017-12-15 08:00:00,2017,12,15,7,30,1.2000000000000002,1.37,0.045,0.63,0,0,0,0,6,-4.4,0,0,0,0,0.307,66.42,99.29,0.95,0.15,884,1.3,299,2.9000000000000004,0.0,0.0,273.0
221,Telus Spark,594148,220 ST GEORGES DR NE,15/12/2017 9:00,2.898,https://monitoringpublic.solaredge.com/solaredge-web/p/site/public?name=TELUS%20Spark,27/11/2017,5941482017-12-15 09:00:00,2017-12-15 09:00:00,2017,12,15,8,30,1.0,1.43,0.051,0.63,0,0,0,0,8,-3.5,0,0,0,0,0.308,71.88,91.25,0.95,0.15,884,1.3,299,2.8000000000000003,0.0,0.0,273.0
222,Telus Spark,594148,220 ST GEORGES DR NE,15/12/2017 10:00,9.644,https://monitoringpublic.solaredge.com/solaredge-web/p/site/public?name=TELUS%20Spark,27/11/2017,5941482017-12-15 10:00:00,2017-12-15 10:00:00,2017,12,15,9,30,1.1,1.47,0.052,0.63,30,437,74,7,8,-3.0,48,12,7,49,0.311,73.84,84.23,0.94,0.15,884,1.2000000000000002,296,2.5,0.0,0.0,273.0
223,Telus Spark,594148,220 ST GEORGES DR NE,15/12/2017 11:00,6.797,https://monitoringpublic.solaredge.com/solaredge-web/p/site/public?name=TELUS%20Spark,27/11/2017,5941482017-12-15 11:00:00,2017-12-15 11:00:00,2017,12,15,10,30,1.6,1.48,0.052,0.63,45,627,165,7,8,-2.8000000000000003,73,9,7,75,0.315,72.68,78.94,0.94,0.15,884,1.1,295,2.3000000000000003,3.5772,2.7298,273.0
224,Telus Spark,594148,220 ST GEORGES DR NE,15/12/2017 12:00,21.271,https://monitoringpublic.solaredge.com/solaredge-web/p/site/public?name=TELUS%20Spark,27/11/2017,5941482017-12-15 12:00:00,2017-12-15 12:00:00,2017,12,15,11,30,2.6,1.48,0.057,0.63,53,703,229,7,8,-2.7,51,1,7,52,0.319,68.27,75.52,0.94,0.15,884,1.0,300,2.3000000000000003,2.5315,1.9436,273.0
225,Telus Spark,594148,220 ST GEORGES DR NE,15/12/2017 13:00,10.837,https://monitoringpublic.solaredge.com/solaredge-web/p/site/public?name=TELUS%20Spark,27/11/2017,5941482017-12-15 13:00:00,2017-12-15 13:00:00,2017,12,15,12,30,3.7,1.52,0.053,0.63,55,751,258,7,4,-2.7,136,8,7,138,0.323,62.79,74.3,0.93,0.15,884,0.7000000000000001,307,2.4000000000000004,6.7904,5.2249,273.0
226,Telus Spark,594148,220 ST GEORGES DR NE,15/12/2017 14:00,8.996,https://monitoringpublic.solaredge.com/solaredge-web/p/site/public?name=TELUS%20Spark,27/11/2017,5941482017-12-15 14:00:00,2017-12-15 14:00:00,2017,12,15,13,30,3.7,1.55,0.04,0.63,49,760,240,1,4,-2.8000000000000003,131,11,1,134,0.326,62.32,75.41,0.91,0.15,884,0.6000000000000001,315,2.1,6.5295,5.0143,273.0
227,Telus Spark,594148,220 ST GEORGES DR NE,15/12/2017 15:00,3.347,https://monitoringpublic.solaredge.com/solaredge-web/p/site/public?name=TELUS%20Spark,27/11/2017,5941482017-12-15 15:00:00,2017-12-15 15:00:00,2017,12,15,14,30,2.2,1.57,0.03,0.63,40,716,180,7,4,-3.5,65,1,7,66,0.33,65.76,78.73,0.89,0.15,884,0.5,322,1.6,3.1496,2.4043,273.0
228,Telus Spark,594148,220 ST GEORGES DR NE,15/12/2017 16:00,0.254,https://monitoringpublic.solaredge.com/solaredge-web/p/site/public?name=TELUS%20Spark,27/11/2017,5941482017-12-15 16:00:00,2017-12-15 16:00:00,2017,12,15,15,30,-0.3,1.59,0.027,0.63,27,564,87,0,1,-4.6000000000000005,27,564,0,87,0.334,72.62,83.95,0.89,0.15,884,0.4,328,1.4,0.0,0.0,273.0
229,Telus Spark,594148,220 ST GEORGES DR NE,16/12/2017 8:00,0.17,https://monitoringpublic.solaredge.com/solaredge-web/p/site/public?name=TELUS%20Spark,27/11/2017,5941482017-12-16 08:00:00,2017-12-16 08:00:00,2017,12,16,7,30,-5.9,1.33,0.024,0.63,0,0,0,0,4,-11.8,0,0,0,0,0.358,63.05,99.39,0.91,0.46,890,0.4,291,1.6,0.0,0.0,273.0
230,Telus Spark,594148,220 ST GEORGES DR NE,16/12/2017 9:00,2.595,https://monitoringpublic.solaredge.com/solaredge-web/p/site/public?name=TELUS%20Spark,27/11/2017,5941482017-12-16 09:00:00,2017-12-16 09:00:00,2017,12,16,8,30,-5.800000000000001,1.33,0.02,0.63,0,0,0,0,4,-12.0,0,0,0,0,0.356,61.64,91.35,0.9,0.46,891,0.4,286,1.6,0.0,0.0,273.0
231,Telus Spark,594148,220 ST GEORGES DR NE,16/12/2017 10:00,4.708,https://monitoringpublic.solaredge.com/solaredge-web/p/site/public?name=TELUS%20Spark,27/11/2017,5941482017-12-16 10:00:00,2017-12-16 10:00:00,2017,12,16,9,30,-4.6000000000000005,1.33,0.017,0.63,25,572,82,0,1,-11.9,25,572,0,82,0.356,56.53,84.31,0.89,0.46,891,0.4,275,1.7000000000000002,0.0,0.0,273.0
232,Telus Spark,594148,220 ST GEORGES DR NE,16/12/2017 11:00,5.893,https://monitoringpublic.solaredge.com/solaredge-web/p/site/public?name=TELUS%20Spark,27/11/2017,5941482017-12-16 11:00:00,2017-12-16 11:00:00,2017,12,16,10,30,-2.6,1.33,0.015,0.63,36,765,182,0,0,-11.2,36,765,0,182,0.357,51.59,79.01,0.89,0.46,891,0.3,262,2.1,8.6794,6.6226,273.0
233,Telus Spark,594148,220 ST GEORGES DR NE,16/12/2017 12:00,5.556,https://monitoringpublic.solaredge.com/solaredge-web/p/site/public?name=TELUS%20Spark,27/11/2017,5941482017-12-16 12:00:00,2017-12-16 12:00:00,2017,12,16,11,30,-1.0,1.46,0.02,0.63,44,826,250,0,1,-11.3,44,826,0,250,0.356,45.6,75.58,0.89,0.46,891,0.3,248,2.5,12.1646,9.3387,273.0
234,Telus Spark,594148,220 ST GEORGES DR NE,16/12/2017 13:00,5.31,https://monitoringpublic.solaredge.com/solaredge-web/p/site/public?name=TELUS%20Spark,27/11/2017,5941482017-12-16 13:00:00,2017-12-16 13:00:00,2017,12,16,12,30,0.0,1.48,0.021,0.63,47,846,275,1,1,-11.2,47,846,1,275,0.353,42.83,74.34,0.89,0.46,891,0.3,234,2.8000000000000003,13.5267,10.4074,273.0
235,Telus Spark,594148,220 ST GEORGES DR NE,16/12/2017 14:00,4.764,https://monitoringpublic.solaredge.com/solaredge-web/p/site/public?name=TELUS%20Spark,27/11/2017,5941482017-12-16 14:00:00,2017-12-16 14:00:00,2017,12,16,13,30,0.2,1.54,0.023,0.63,46,824,253,0,1,-10.8,46,824,0,253,0.35,43.56,75.43,0.89,0.46,890,0.3,228,2.8000000000000003,12.3261,9.4653,273.0
236,Telus Spark,594148,220 ST GEORGES DR NE,16/12/2017 15:00,2.723,https://monitoringpublic.solaredge.com/solaredge-web/p/site/public?name=TELUS%20Spark,27/11/2017,5941482017-12-16 15:00:00,2017-12-16 15:00:00,2017,12,16,14,30,-0.8,1.58,0.026,0.63,41,748,187,1,1,-10.2,41,748,1,187,0.349,48.8,78.73,0.9,0.46,890,0.3,230,2.3000000000000003,8.9239,6.8121,273.0
237,Telus Spark,594148,220 ST GEORGES DR NE,16/12/2017 16:00,0.171,https://monitoringpublic.solaredge.com/solaredge-web/p/site/public?name=TELUS%20Spark,27/11/2017,5941482017-12-16 16:00:00,2017-12-16 16:00:00,2017,12,16,15,30,-2.9000000000000004,1.55,0.025,0.63,28,583,90,0,0,-10.0,28,583,0,90,0.35,57.93,83.93,0.9,0.46,889,0.3,234,2.0,0.0,0.0,273.0
238,Telus Spark,594148,220 ST GEORGES DR NE,17/12/2017 9:00,1.029,https://monitoringpublic.solaredge.com/solaredge-web/p/site/public?name=TELUS%20Spark,27/11/2017,5941482017-12-17 09:00:00,2017-12-17 09:00:00,2017,12,17,8,30,-0.3,1.21,0.053,0.63,0,0,0,4,9,-7.800000000000001,0,0,4,0,0.342,57.120000000000005,91.44,0.95,0.44,880,0.9,277,5.1000000000000005,0.0,0.0,273.0
239,Telus Spark,594148,220 ST GEORGES DR NE,17/12/2017 10:00,3.967,https://monitoringpublic.solaredge.com/solaredge-web/p/site/public?name=TELUS%20Spark,27/11/2017,5941482017-12-17 10:00:00,2017-12-17 10:00:00,2017,12,17,9,30,-0.2,1.2,0.061,0.63,32,415,72,4,9,-7.5,13,0,4,13,0.343,57.94,84.4,0.95,0.44,881,0.8,274,4.6000000000000005,0.0,0.0,273.0
240,Telus Spark,594148,220 ST GEORGES DR NE,17/12/2017 11:00,5.636,https://monitoringpublic.solaredge.com/solaredge-web/p/site/public?name=TELUS%20Spark,27/11/2017,5941482017-12-17 11:00:00,2017-12-17 11:00:00,2017,12,17,10,30,0.2,1.22,0.059,0.63,49,623,167,4,9,-7.1000000000000005,23,0,4,23,0.343,57.8,79.08,0.95,0.44,881,0.7000000000000001,272,4.0,1.0967,0.8367,273.0
241,Telus Spark,594148,220 ST GEORGES DR NE,17/12/2017 12:00,9.115,https://monitoringpublic.solaredge.com/solaredge-web/p/site/public?name=TELUS%20Spark,27/11/2017,5941482017-12-17 12:00:00,2017-12-17 12:00:00,2017,12,17,11,30,1.1,1.26,0.047,0.63,54,731,235,4,9,-6.7,64,1,4,64,0.342,55.92,75.63,0.94,0.44,881,0.7000000000000001,270,3.7,3.1128,2.3895,273.0
242,Telus Spark,594148,220 ST GEORGES DR NE,17/12/2017 13:00,8.113,https://monitoringpublic.solaredge.com/solaredge-web/p/site/public?name=TELUS%20Spark,27/11/2017,5941482017-12-17 13:00:00,2017-12-17 13:00:00,2017,12,17,12,30,1.9,1.28,0.041,0.63,54,768,261,4,9,-6.300000000000001,79,2,4,79,0.342,54.53,74.38,0.94,0.44,880,0.7000000000000001,266,3.4000000000000004,3.8844,2.9885,273.0
243,Telus Spark,594148,220 ST GEORGES DR NE,17/12/2017 14:00,4.184,https://monitoringpublic.solaredge.com/solaredge-web/p/site/public?name=TELUS%20Spark,27/11/2017,5941482017-12-17 14:00:00,2017-12-17 14:00:00,2017,12,17,13,30,2.0,1.27,0.043,0.63,53,743,239,4,9,-5.7,73,2,4,73,0.343,56.55,75.45,0.94,0.44,880,0.7000000000000001,265,2.9000000000000004,3.5559,2.7305,273.0
244,Telus Spark,594148,220 ST GEORGES DR NE,17/12/2017 15:00,3.843,https://monitoringpublic.solaredge.com/solaredge-web/p/site/public?name=TELUS%20Spark,27/11/2017,5941482017-12-17 15:00:00,2017-12-17 15:00:00,2017,12,17,14,30,1.5,1.24,0.046,0.63,46,655,174,4,9,-5.1000000000000005,31,0,4,31,0.343,61.6,78.73,0.94,0.44,880,0.8,264,2.4000000000000004,1.4794,1.1293,273.0
245,Telus Spark,594148,220 ST GEORGES DR NE,17/12/2017 16:00,0.889,https://monitoringpublic.solaredge.com/solaredge-web/p/site/public?name=TELUS%20Spark,27/11/2017,5941482017-12-17 16:00:00,2017-12-17 16:00:00,2017,12,17,15,30,0.8,1.25,0.043,0.63,31,483,82,4,6,-5.0,40,2,4,40,0.341,65.07000000000001,83.92,0.94,0.44,880,0.8,260,2.2,0.0,0.0,273.0
246,Telus Spark,594148,220 ST GEORGES DR NE,18/12/2017 9:00,0.445,https://monitoringpublic.solaredge.com/solaredge-web/p/site/public?name=TELUS%20Spark,27/11/2017,5941482017-12-18 09:00:00,2017-12-18 09:00:00,2017,12,18,8,30,-4.0,1.28,0.043,0.63,0,0,0,0,8,-5.7,0,0,0,0,0.332,87.91,91.53,0.94,0.42,882,0.6000000000000001,316,1.1,0.0,0.0,273.0
247,Telus Spark,594148,220 ST GEORGES DR NE,18/12/2017 10:00,4.275,https://monitoringpublic.solaredge.com/solaredge-web/p/site/public?name=TELUS%20Spark,27/11/2017,5941482017-12-18 10:00:00,2017-12-18 10:00:00,2017,12,18,9,30,-3.4000000000000004,1.32,0.037,0.63,29,497,77,7,8,-6.0,16,0,7,16,0.333,82.14,84.47,0.94,0.42,883,0.5,309,1.2000000000000002,0.0,0.0,273.0
248,Telus Spark,594148,220 ST GEORGES DR NE,18/12/2017 11:00,7.64,https://monitoringpublic.solaredge.com/solaredge-web/p/site/public?name=TELUS%20Spark,27/11/2017,5941482017-12-18 11:00:00,2017-12-18 11:00:00,2017,12,18,10,30,-2.2,1.34,0.033,0.63,42,697,174,7,8,-5.800000000000001,61,3,7,62,0.335,76.37,79.14,0.94,0.42,883,0.5,301,1.6,2.9561,2.2551,273.0
249,Telus Spark,594148,220 ST GEORGES DR NE,18/12/2017 12:00,12.303,https://monitoringpublic.solaredge.com/solaredge-web/p/site/public?name=TELUS%20Spark,27/11/2017,5941482017-12-18 12:00:00,2017-12-18 12:00:00,2017,12,18,11,30,-1.1,1.34,0.031,0.63,49,779,241,7,8,-5.5,77,5,7,78,0.337,71.91,75.68,0.93,0.42,883,0.5,297,2.0,3.7922,2.9107,273.0
250,Telus Spark,594148,220 ST GEORGES DR NE,18/12/2017 13:00,13.508,https://monitoringpublic.solaredge.com/solaredge-web/p/site/public?name=TELUS%20Spark,27/11/2017,5941482017-12-18 13:00:00,2017-12-18 13:00:00,2017,12,18,12,30,-0.4,1.34,0.028,0.63,50,819,270,7,8,-6.0,119,19,7,124,0.339,66.05,74.4,0.92,0.42,884,0.4,297,2.6,6.096,4.6897,273.0
251,Telus Spark,594148,220 ST GEORGES DR NE,18/12/2017 14:00,5.046,https://monitoringpublic.solaredge.com/solaredge-web/p/site/public?name=TELUS%20Spark,27/11/2017,5941482017-12-18 14:00:00,2017-12-18 14:00:00,2017,12,18,13,30,-0.4,1.36,0.024,0.63,46,809,249,7,4,-6.7,147,15,7,151,0.342,62.51,75.45,0.91,0.42,884,0.4,297,2.6,7.3554,5.6481,273.0
252,Telus Spark,594148,220 ST GEORGES DR NE,18/12/2017 15:00,2.413,https://monitoringpublic.solaredge.com/solaredge-web/p/site/public?name=TELUS%20Spark,27/11/2017,5941482017-12-18 15:00:00,2017-12-18 15:00:00,2017,12,18,14,30,-1.4,1.36,0.021,0.63,39,746,185,0,1,-7.1000000000000005,39,746,0,185,0.343,65.31,78.72,0.9,0.42,885,0.4,294,1.9,8.8287,6.7395,273.0
253,Telus Spark,594148,220 ST GEORGES DR NE,18/12/2017 16:00,0.221,https://monitoringpublic.solaredge.com/solaredge-web/p/site/public?name=TELUS%20Spark,27/11/2017,5941482017-12-18 16:00:00,2017-12-18 16:00:00,2017,12,18,15,30,-3.6,1.35,0.021,0.63,27,580,89,0,0,-7.300000000000001,27,580,0,89,0.344,75.3,83.89,0.9,0.42,886,0.4,285,1.3,0.0,0.0,273.0
254,Telus Spark,594148,220 ST GEORGES DR NE,19/12/2017 8:00,0.06,https://monitoringpublic.solaredge.com/solaredge-web/p/site/public?name=TELUS%20Spark,27/11/2017,5941482017-12-19 08:00:00,2017-12-19 08:00:00,2017,12,19,7,30,-7.6,1.28,0.024,0.63,0,0,0,4,8,-11.5,0,0,4,0,0.377,73.73,99.67,0.93,0.8,889,0.5,184,1.1,0.0,0.0,273.0
255,Telus Spark,594148,220 ST GEORGES DR NE,19/12/2017 9:00,2.383,https://monitoringpublic.solaredge.com/solaredge-web/p/site/public?name=TELUS%20Spark,27/11/2017,5941482017-12-19 09:00:00,2017-12-19 09:00:00,2017,12,19,8,30,-7.6,1.26,0.028,0.63,0,0,0,4,8,-11.4,0,0,4,0,0.378,74.46000000000001,91.61,0.93,0.8,890,0.5,33,1.4,0.0,0.0,273.0
256,Telus Spark,594148,220 ST GEORGES DR NE,19/12/2017 10:00,3.899,https://monitoringpublic.solaredge.com/solaredge-web/p/site/public?name=TELUS%20Spark,27/11/2017,5941482017-12-19 10:00:00,2017-12-19 10:00:00,2017,12,19,9,30,-7.300000000000001,1.26,0.033,0.63,28,500,76,4,8,-11.0,34,1,4,34,0.379,74.96000000000001,84.54,0.93,0.8,890,0.5,59,2.0,0.0,0.0,273.0
257,Telus Spark,594148,220 ST GEORGES DR NE,26/12/2017 12:00,0.003,https://monitoringpublic.solaredge.com/solaredge-web/p/site/public?name=TELUS%20Spark,27/11/2017,5941482017-12-26 12:00:00,2017-12-26 12:00:00,2017,12,26,11,30,-20.4,1.29,0.017,0.63,45,843,253,7,8,-26.1,161,50,7,174,0.395,60.35,75.77,0.9,0.8,895,0.2,180,1.4,8.4533,6.4873,273.0
258,Telus Spark,594148,220 ST GEORGES DR NE,26/12/2017 13:00,0.001,https://monitoringpublic.solaredge.com/solaredge-web/p/site/public?name=TELUS%20Spark,27/11/2017,5941482017-12-26 13:00:00,2017-12-26 13:00:00,2017,12,26,12,30,-18.1,1.25,0.018,0.63,49,865,282,1,8,-23.0,149,17,1,154,0.399,65.4,74.34,0.91,0.8,894,0.2,162,1.8,7.5749,5.8281,273.0
259,Telus Spark,594148,220 ST GEORGES DR NE,29/12/2017 12:00,0.006,https://monitoringpublic.solaredge.com/solaredge-web/p/site/public?name=TELUS%20Spark,27/11/2017,5941482017-12-29 12:00:00,2017-12-29 12:00:00,2017,12,29,11,30,-24.0,1.15,0.041,0.63,57,773,248,7,8,-28.200000000000003,124,9,7,126,0.395,67.92,75.68,0.95,0.8,903,0.3,99,1.4,6.1259,4.7019,273.0
260,Telus Spark,594148,220 ST GEORGES DR NE,29/12/2017 13:00,0.557,https://monitoringpublic.solaredge.com/solaredge-web/p/site/public?name=TELUS%20Spark,27/11/2017,5941482017-12-29 13:00:00,2017-12-29 13:00:00,2017,12,29,12,30,-23.6,1.15,0.044,0.63,61,796,278,7,8,-27.9,96,3,7,97,0.395,67.92,74.19,0.95,0.8,903,0.3,103,1.6,4.7777,3.6769,273.0
261,Telus Spark,594148,220 ST GEORGES DR NE,29/12/2017 14:00,0.563,https://monitoringpublic.solaredge.com/solaredge-web/p/site/public?name=TELUS%20Spark,27/11/2017,5941482017-12-29 14:00:00,2017-12-29 14:00:00,2017,12,29,13,30,-23.5,1.15,0.041,0.63,58,786,261,7,8,-27.6,120,7,7,122,0.393,68.68,75.03,0.95,0.8,902,0.3,102,1.8,5.9642,4.5833,273.0
262,Telus Spark,594148,220 ST GEORGES DR NE,29/12/2017 15:00,0.19,https://monitoringpublic.solaredge.com/solaredge-web/p/site/public?name=TELUS%20Spark,27/11/2017,5941482017-12-29 15:00:00,2017-12-29 15:00:00,2017,12,29,14,30,-23.6,1.15,0.041,0.63,51,719,199,7,8,-27.6,94,4,7,95,0.39,69.79,78.11,0.96,0.8,902,0.3,103,1.8,4.544,3.4723,273.0
263,Telus Spark,594148,220 ST GEORGES DR NE,29/12/2017 16:00,0.001,https://monitoringpublic.solaredge.com/solaredge-web/p/site/public?name=TELUS%20Spark,27/11/2017,5941482017-12-29 16:00:00,2017-12-29 16:00:00,2017,12,29,15,30,-23.9,1.14,0.044,0.63,36,538,100,7,8,-27.5,48,1,7,48,0.386,71.95,83.13,0.96,0.8,902,0.4,107,1.7000000000000002,0.0,0.0,273.0
264,Telus Spark,594148,220 ST GEORGES DR NE,30/12/2017 12:00,0.003,https://monitoringpublic.solaredge.com/solaredge-web/p/site/public?name=TELUS%20Spark,27/11/2017,5941482017-12-30 12:00:00,2017-12-30 12:00:00,2017,12,30,11,30,-25.3,1.11,0.039,0.63,55,777,248,7,8,-29.3,147,22,7,153,0.419,69.42,75.63,0.93,0.8,898,0.3,126,2.4000000000000004,7.4416,5.7124,273.0
265,Telus Spark,594148,220 ST GEORGES DR NE,30/12/2017 13:00,0.014,https://monitoringpublic.solaredge.com/solaredge-web/p/site/public?name=TELUS%20Spark,27/11/2017,5941482017-12-30 13:00:00,2017-12-30 13:00:00,2017,12,30,12,30,-24.8,1.1,0.038,0.63,58,807,279,0,1,-28.8,58,807,0,279,0.419,69.59,74.13,0.93,0.8,899,0.3,127,2.2,13.7496,10.5827,273.0
266,Telus Spark,594148,220 ST GEORGES DR NE,31/12/2017 10:00,0.006,https://monitoringpublic.solaredge.com/solaredge-web/p/site/public?name=TELUS%20Spark,27/11/2017,5941482017-12-31 10:00:00,2017-12-31 10:00:00,2017,12,31,9,30,-28.3,1.16,0.018,0.63,25,597,80,0,0,-33.1,25,597,0,80,0.383,63.32,84.8,0.9,0.8,901,0.1,164,1.6,0.0,0.0,273.0
267,Telus Spark,594148,220 ST GEORGES DR NE,31/12/2017 11:00,0.04,https://monitoringpublic.solaredge.com/solaredge-web/p/site/public?name=TELUS%20Spark,27/11/2017,5941482017-12-31 11:00:00,2017-12-31 11:00:00,2017,12,31,10,30,-25.4,1.17,0.017,0.63,39,790,186,0,0,-30.8,39,790,0,186,0.383,60.6,79.28,0.89,0.8,901,0.1,154,2.0,8.8666,6.7628,273.0
268,Telus Spark,594148,220 ST GEORGES DR NE,31/12/2017 13:00,0.049,https://monitoringpublic.solaredge.com/solaredge-web/p/site/public?name=TELUS%20Spark,27/11/2017,5941482017-12-31 13:00:00,2017-12-31 13:00:00,2017,12,31,12,30,-21.1,1.17,0.015,0.63,48,899,294,0,1,-25.200000000000003,48,899,0,294,0.386,69.48,74.06,0.89,0.8,900,0.1,143,2.7,14.4981,11.1601,273.0
269,Telus Spark,594148,220 ST GEORGES DR NE,31/12/2017 14:00,0.007,https://monitoringpublic.solaredge.com/solaredge-web/p/site/public?name=TELUS%20Spark,27/11/2017,5941482017-12-31 14:00:00,2017-12-31 14:00:00,2017,12,31,13,30,-20.4,1.17,0.015,0.63,46,886,277,0,1,-23.9,46,886,0,277,0.388,73.57000000000001,74.86,0.89,0.8,900,0.1,140,2.8000000000000003,13.562,10.425,273.0
270,Telus Spark,594148,220 ST GEORGES DR NE,1/01/2018 10:00,0.01,https://monitoringpublic.solaredge.com/solaredge-web/p/site/public?name=TELUS%20Spark,27/11/2017,5941482018-01-01 10:00:00,2018-01-01 10:00:00,2018,1,1,9,30,-19.8,1.0,0.012,0.64,24,619,80,0,0,-24.8,24,619,0,80,0.366,64.66,84.79,0.87,0.8,899,0.1,253,2.2,0.0,0.0,273.0
271,Telus Spark,594148,220 ST GEORGES DR NE,1/01/2018 11:00,0.04,https://monitoringpublic.solaredge.com/solaredge-web/p/site/public?name=TELUS%20Spark,27/11/2017,5941482018-01-01 11:00:00,2018-01-01 11:00:00,2018,1,1,10,30,-16.6,0.97,0.012,0.64,36,805,186,0,0,-22.0,36,805,0,186,0.361,63.04,79.25,0.87,0.8,899,0.1,247,2.3000000000000003,8.8669,6.7633,273.0
272,Telus Spark,594148,220 ST GEORGES DR NE,1/01/2018 12:00,0.075,https://monitoringpublic.solaredge.com/solaredge-web/p/site/public?name=TELUS%20Spark,27/11/2017,5941482018-01-01 12:00:00,2018-01-01 12:00:00,2018,1,1,11,30,-13.3,0.95,0.012,0.64,42,883,263,0,0,-18.1,42,883,0,263,0.355,67.0,75.53,0.87,0.8,898,0.1,241,2.4000000000000004,12.8025,9.8293,273.0
273,Telus Spark,594148,220 ST GEORGES DR NE,1/01/2018 13:00,0.259,https://monitoringpublic.solaredge.com/solaredge-web/p/site/public?name=TELUS%20Spark,27/11/2017,5941482018-01-01 13:00:00,2018-01-01 13:00:00,2018,1,1,12,30,-11.0,0.94,0.012,0.64,45,909,296,0,0,-14.7,45,909,0,296,0.351,73.99,73.98,0.88,0.8,897,0.1,235,2.6,14.6074,11.2458,273.0
274,Telus Spark,594148,220 ST GEORGES DR NE,1/01/2018 14:00,1.261,https://monitoringpublic.solaredge.com/solaredge-web/p/site/public?name=TELUS%20Spark,27/11/2017,5941482018-01-01 14:00:00,2018-01-01 14:00:00,2018,1,1,13,30,-9.9,0.95,0.013,0.64,45,894,280,7,8,-12.5,150,320,100,234,0.348,81.59,74.76,0.88,0.8,897,0.1,238,2.5,11.4668,8.816,273.0
275,Telus Spark,594148,220 ST GEORGES DR NE,1/01/2018 15:00,0.929,https://monitoringpublic.solaredge.com/solaredge-web/p/site/public?name=TELUS%20Spark,27/11/2017,5941482018-01-01 15:00:00,2018-01-01 15:00:00,2018,1,1,14,30,-9.8,0.97,0.014,0.64,41,834,217,7,8,-11.4,129,225,100,177,0.348,88.02,77.8,0.89,0.8,896,0.1,249,2.3000000000000003,8.4791,6.4828,273.0
276,Telus Spark,594148,220 ST GEORGES DR NE,1/01/2018 16:00,0.112,https://monitoringpublic.solaredge.com/solaredge-web/p/site/public?name=TELUS%20Spark,27/11/2017,5941482018-01-01 16:00:00,2018-01-01 16:00:00,2018,1,1,15,30,-10.2,1.01,0.014,0.64,30,695,117,7,4,-11.6,38,0,100,38,0.35,89.81,82.79,0.9,0.8,897,0.1,262,2.5,0.0,0.0,273.0
277,Telus Spark,594148,220 ST GEORGES DR NE,2/01/2018 8:00,0.014,https://monitoringpublic.solaredge.com/solaredge-web/p/site/public?name=TELUS%20Spark,27/11/2017,5941482018-01-02 08:00:00,2018-01-02 08:00:00,2018,1,2,7,30,-5.4,1.46,0.066,0.64,0,0,0,0,0,-8.1,0,0,0,0,0.328,81.56,100.22,0.92,0.8,900,1.0,300,2.0,0.0,0.0,273.0
278,Telus Spark,594148,220 ST GEORGES DR NE,2/01/2018 9:00,1.584,https://monitoringpublic.solaredge.com/solaredge-web/p/site/public?name=TELUS%20Spark,27/11/2017,5941482018-01-02 09:00:00,2018-01-02 09:00:00,2018,1,2,8,30,-5.0,1.43,0.061,0.64,0,0,0,0,0,-7.800000000000001,0,0,0,0,0.328,80.43,92.02,0.92,0.8,900,1.0,295,2.0,0.0,0.0,273.0
279,Telus Spark,594148,220 ST GEORGES DR NE,2/01/2018 10:00,5.182,https://monitoringpublic.solaredge.com/solaredge-web/p/site/public?name=TELUS%20Spark,27/11/2017,5941482018-01-02 10:00:00,2018-01-02 10:00:00,2018,1,2,9,30,-3.9,1.44,0.056,0.64,29,412,67,0,0,-7.2,29,412,0,67,0.327,77.81,84.77,0.91,0.8,901,0.9,286,2.3000000000000003,0.0,0.0,273.0
280,Telus Spark,594148,220 ST GEORGES DR NE,3/01/2018 8:00,0.021,https://monitoringpublic.solaredge.com/solaredge-web/p/site/public?name=TELUS%20Spark,27/11/2017,5941482018-01-03 08:00:00,2018-01-03 08:00:00,2018,1,3,7,30,-4.3,1.3,0.023,0.64,0,0,0,0,4,-6.2,0,0,0,0,0.292,86.41,100.21,0.89,0.74,894,0.7000000000000001,282,3.0,0.0,0.0,273.0
281,Telus Spark,594148,220 ST GEORGES DR NE,3/01/2018 9:00,1.987,https://monitoringpublic.solaredge.com/solaredge-web/p/site/public?name=TELUS%20Spark,27/11/2017,5941482018-01-03 09:00:00,2018-01-03 09:00:00,2018,1,3,8,30,-4.2,1.34,0.024,0.64,0,0,0,0,0,-6.5,0,0,0,0,0.29,84.31,92.0,0.89,0.74,895,0.7000000000000001,283,3.1,0.0,0.0,273.0
